Body ID,articleBody
0,It is native to parts of South and Southeast Asia and is believed to have originated in the southwestern rain forests of the Western Ghats in the Indian subcontinent .
1,"Dangerous Liaisons is a 1988 American historical drama film based upon Christopher Hampton 's play Les liaisons dangereuses , which in turn was a theatrical adaptation of the 18th-century French novel Les Liaisons dangereuses by Pierre Choderlos de Laclos ."
2,"Jacqueline Marie `` Jackie '' Evancho  (  [ iːˈvæŋkoʊ ]  ; born April 9 , 2000 )  is an American classical crossover singer who gained wide recognition at an early age and , since 2009 , has issued an EP and seven albums , including a platinum and gold album and three Billboard 200 top 10 debuts ."
3,"Joseph Roland `` Joe '' Barbera  (  [ bɑrˈbɛrə ]  or  [ ˈbɑrbərə ]  ;  [ barˈbɛːra ]  ; March 24 , 1911 -- December 18 , 2006 )  was an American animator , director , producer , storyboard artist , and cartoon artist , whose film and television cartoon characters entertained millions of fans worldwide for much of the 20th century ."
4,"In 1998 , Kelly won three Grammy Awards for `` I Believe I Can Fly '' ."
5,is a Japanese manga artist from Miyagi .
6,"Laura Leggett Linney  ( born February 5 , 1964 )  is an American actress ."
7,"Katie Price  ( born Katrina Amy Alexandra Alexis Infield , 22 May 1978 )  , previously known by the pseudonym Jordan , is an English television personality and glamour model ."
8,"Cindy Lou Hensley McCain  ( born May 20 , 1954 )  is an American businesswoman , philanthropist , and humanitarian , and the wife of long-time United States Senator and 2008 Republican presidential nominee John McCain of Arizona ."
9,Turner has also starred in the television film The Thirteenth Tale  ( 2013 )  and she made her feature film debut in Another Me  ( 2013 )  .
10,"The House at Pooh Corner  ( 1928 )  is the second volume of stories about Winnie-the-Pooh , written by A. A. Milne and illustrated by E. H. Shepard ."
11,"It is the first instalment in the Fifty Shades trilogy that traces the deepening relationship between a college graduate , Anastasia Steele , and a young business magnate , Christian Grey ."
12,"Jesus  (  [ ˈdʒiːzəs ]  ; c. 4 BC -- c. AD 30/33 )  , also referred to as Jesus of Nazareth or Jesus Christ , was a Jewish preacher and religious leader who became the central figure of Christianity ."
13,"NASA also awarded SpaceX a further development contract in 2011 to develop and demonstrate a human-rated Dragon , which would be used to transport astronauts to the ISS and return them safely to Earth ."
14,"Empress Matilda  ( c. 7 February 110210 September 1167 )  , also known as the Empress Maude , was the claimant to the English throne during the civil war known as the Anarchy ."
15,"Due to its location in the European Plain , Berlin is influenced by a temperate seasonal climate ."
16,Karl-Heinz Urban  ( born 7 June 1972 )  is a New Zealand actor .
17,"The Illusionist is a 2006 American romantic mystery film written and directed by Neil Burger and starring Edward Norton , Paul Giamatti , and Jessica Biel ."
18,The film involves a young man who falls in love with a mysterious woman who is secretly a mermaid .
19,"The album has sold upwards of 1,200,000 copies in the USA , and has been certified Platinum by the RIAA ."
20,"Michael Richard Pence  ( born June 7 , 1959 )  is an American politician , lawyer , and the 48th and current Vice President of the United States ."
21,"After leaving Southampton on 10 April 1912 , Titanic called at Cherbourg in France and Queenstown  ( now Cobh )  in Ireland before heading west to New York ."
22,"Stanley Tucci  (  [ ˈtuːtʃi ]   [ ˈtuttʃi ]  ; born November 11 , 1960 )  is an American character actor , writer , producer and film director ."
23,"He was Prime Minister from 1999 to 2000 , President from 2000 to 2008 , and again Prime Minister from 2008 to 2012 ."
24,Amazon Web Services  ( AWS )  describes both a technology and a company .
25,"He has sold more than 20 million records worldwide and is known for his international hits , including `` Kiss from a Rose '' , which appeared on the soundtrack to the 1995 film Batman Forever ."
26,"Some of his notable credits include Breaking Away , The Right Stuff , Wyatt Earp , The Rookie , The Day After Tomorrow , Traffic , Vantage Point , Footloose , Frequency , The Parent Trap , Yours , Mine & Ours and Soul Surfer ."
27,"The film premiered on September 11 , 2016 , at the Toronto International Film Festival and was released in the United States on April 21 , 2017 , by Open Road Films ."
28,"Adolf Hitler  (  [ ˈadɔlf ˈhɪtlɐ ]  ; 20 April 1889 -- 30 April 1945 )  was a German politician who was the leader of the Nazi Party  ( Nationalsozialistische Deutsche Arbeiterpartei ; NSDAP )  , Chancellor of Germany from 1933 to 1945 , and Führer  ( `` Leader '' )  of Nazi Germany from 1934 to 1945 ."
29,"Often considered the best player in the world and regarded by many as the greatest of all time , Messi is the only player in history to win five FIFA Ballon d'Or awards , four of which he won consecutively , and the first to win three European Golden Shoes ."
30,"Dolores Janney Rivera Saavedra  ( July 2 , 1969 -- December 9 , 2012 )  , better known as Jenni Rivera , was an American singer , songwriter , actress , television producer , spokesperson , philanthropist and entrepreneur known for her work within the Banda and ranchera music genres ."
31,"The origins of the Internet date back to research commissioned by the United States federal government in the 1960s to build robust , fault-tolerant communication via computer networks ."
32,"The population of the city was 343,829 as of the 2010 U.S. Census ."
33,"Jules Sébastien César Dumont d'Urville  ( 23 May 1790 -- 8 May 1842 )  was a French explorer , naval officer and rear admiral , who explored the south and western Pacific , Australia , New Zealand and Antarctica ."
34,"Christina María Aguilera  ( born December 18 , 1980 )  is an American singer , songwriter , actress and television personality ."
35,"He lived in Aspen , Colorado for much of his life and was known for his love of Colorado which he sang about numerous times ."
36,"He was at different times a constable , city policeman , county sheriff , Deputy U.S. Marshal , teamster , buffalo hunter , bouncer , saloon-keeper , gambler , brothel keeper , miner , and boxing referee ."
37,"Nicholas Jerry Jonas  ( born September 16 , 1992 )  is an American singer , songwriter , producer , and actor ."
38,"Rebecca Louisa Ferguson Sundström  ( born 19 October 1983 )  , known professionally as Rebecca Ferguson , is a Swedish actress ."
39,Michael Schumacher  (  [ ˈmɪçaʔɛl ˈʃuːmaxɐ ]  ; born 3 January 1969 )  is a German retired racing driver .
40,"That '70s Show is an American television period sitcom that originally aired on Fox from August 23 , 1998 , to May 18 , 2006 ."
41,"Countess Rose Elizabeth Fitzgerald Kennedy  ( July 22 , 1890 -- January 22 , 1995 )  was an American philanthropist , centenarian and socialite ."
42,Jun has also starred in television series My Love from the Star  ( 2013-2014 )  and The Legend of the Blue Sea  ( 2016-2017 )  .
43,"Billy Bob Thornton  ( born August 4 , 1955 )  is an American actor , filmmaker , singer , songwriter , and musician ."
44,"Cordozar Calvin Broadus , Jr.  ( born October 20 , 1971 )  , known professionally as Snoop Dogg  ( sometimes shortened to Snoop and formerly called Snoop Doggy Dogg and Snoop Lion )  , is an American rapper and actor from Long Beach , California ."
45,"Maynard James Keenan  ( born James Herbert Keenan ; April 17 , 1964 )  , often referred to by his initials MJK , is an American musician , record producer , winemaker , and actor , best known as the vocalist for Grammy Award-winning progressive metal band Tool ."
46,"After being dropped by her record label , Nash self-released her third studio album , Girl Talk , on 4 March 2013 ."
47,"Abigail Kathleen Breslin  ( born April 14 , 1996 )  is an American actress and singer ."
48,Louis-Dreyfus holds several records for most Primetime Emmy Award wins and nominations .
49,"Nicole Mary Kidman , AC  ( born June 20 , 1967 )  is an Australian actress and film producer ."
50,Jane Eyre is a 2011 British romantic drama film directed by Cary Fukunaga and starring Mia Wasikowska and Michael Fassbender .
51,"Tramadol , sold under the brandname Ultram among others , is an opioid pain medication used to treat moderate to moderately severe pain ."
52,"Interstellar is a 2014 British-American epic science fiction film directed , co-written , and co-produced by Christopher Nolan ."
53,"A fictionalized account of the sinking of the RMS Titanic , it stars Leonardo DiCaprio and Kate Winslet as members of different social classes who fall in love aboard the ship during its ill-fated maiden voyage ."
54,Thenmerku Paruvakatru  ( Southwest Monsoon )  is a 2010 Tamil drama film written and directed by Seenu Ramasamy and produced by Shibu Issac .
55,"Leslie Howard  ( born Leslie Howard Steiner , 3 April 18931 June 1943 )  was an English stage and film actor , director and producer ."
56,"He went on to star in several hit films , including An Officer and a Gentleman , Pretty Woman , Primal Fear , Runaway Bride , Arbitrage and Chicago , for which he won a Golden Globe Award for Best Actor and a Screen Actors Guild Award for part of the Best Cast ."
57,"He is currently signed to WWE , performing as the on-screen general manager for the Raw brand ."
58,"The castle , which has been a Grade I listed building since 1951 , underwent a major restoration in the early 20th century ."
59,"Muhammad Ali  (  [ ɑːˈliː ]  born Cassius Marcellus Clay Jr. ; January 17 , 1942 -- June 3 , 2016 )  was an American professional boxer and activist ."
60,"The film was produced by Big Beach and Raindog Films , and distributed by Focus Features ."
61,Robert Browning  ( 7 May 1812 -- 12 December 1889 )  was an English poet and playwright whose mastery of the dramatic monologue made him one of the foremost Victorian poets .
62,"She married John McCain in 1980 and the couple moved to Arizona in 1981 , where her husband would be elected to the United States Congress the following year and has been in office since then ."
63,"Born and raised in Barranquilla , she began performing in school , demonstrating Latin American , Arabic , and rock and roll influences and belly dancing abilities ."
64,"`` All the Lovers '' is a song recorded by Australian recording artist Kylie Minogue for her eleventh studio album , Aphrodite  ( 2010 )  ."
65,"A central venous catheter  ( CVC )  , also known as a central line , central venous line , or central venous access catheter , is a catheter placed into a large vein ."
66,"Michelle LaVaughn Robinson Obama  ( born January 17 , 1964 )  is an American lawyer and writer who was First Lady of the United States from 2009 to 2017 ."
67,It is the second film in the Marvel Cinematic Universe  ( MCU )  .
68,"He was Clinton 's running mate in their successful campaign in 1992 , and was re-elected in 1996 ."
69,"Zendaya Maree Stoermer Coleman  ( born September 1 , 1996 )  , known mononymously as Zendaya  (  [ zɛnˈdeɪ.ə ]  )  , is an American actress , singer , and dancer ."
70,"A mixtape  ( also mix-tape or mix tape )  is a home-made compilation of music  ( typically copyrighted songs taken from other sources )  recorded in a specific order , traditionally onto a cassette tape , though later replaced by CD or MP3 playlist formats ."
71,"After beginnings in dance and modeling , she turned her attention to acting , and made her American acting debut  ( and came to prominence in what would be a Golden Globe -- nominated role )  in her portrayal of Tonya in David Lean 's Doctor Zhivago  ( 1965 )  ."
72,"Hayden Leslie Panettiere  ( born August 21 , 1989 )  is an American actress , model , singer , and activist ."
73,"In 2012 , the book received an Alex Award from the Young Adult Library Services Association division of the American Library Association and won the 2012 Prometheus Award ."
74,"William McKinley Jr.  ( January 29 , 1843 -- September 14 , 1901 )  was an American politician and lawyer who served as the 25th President of the United States from March 4 , 1897 until his assassination in September 1901 , six months into his second term ."
75,It is the 56th Disney animated feature film .
76,"Michael Joseph Jackson  ( August 29 , 1958 -- June 25 , 2009 )  was an American singer , songwriter , record producer , dancer , actor , and philanthropist ."
77,"Roger Keith `` Syd '' Barrett  ( 6 January 1946 -- 7 July 2006 )  was a British musician , composer , singer-songwriter , and painter ."
78,"Jerrald King `` Jerry '' Goldsmith  ( February 10 , 1929July 21 , 2004 )  was an American composer and conductor most known for his work in film and television scoring ."
79,"A co-production of the United Kingdom and Germany , the film was nominated for the Palme d'Or at the 2013 Cannes Film Festival ."
80,"Stone Temple Pilots  ( sometimes abbreviated as STP )  are an American rock band from San Diego , California , that originally consisted of Scott Weiland  ( lead vocals )  , brothers Dean  ( guitar )  and Robert DeLeo  ( bass , backing vocals )  , and Eric Kretz  ( drums )  ."
81,"The album features contributions from the reggae production duo Sly and Robbie and is a departure from Jones ' earlier disco sound , moving towards a new wave-reggae direction ."
82,"From the Earth to the Moon is a twelve-part HBO television miniseries  ( 1998 )  co-produced by Ron Howard , Brian Grazer , Tom Hanks , and Michael Bostick , telling the story of the landmark Apollo expeditions to the Moon during the 1960s and early 1970s in docudrama format ."
83,"Uruguay also won the 1980 Mundialito , a tournament among former World Cup champions ."
84,"Willie Hugh Nelson  ( born April 29 , 1933 )  is an American musician , singer , songwriter , author , poet , actor , and activist ."
85,"He made one of his earliest film roles in the mid-1980s , before he starred in Cameron Crowe 's film Say Anything ...  ( 1989 )  , for which he gained teen idol status ."
86,"Neal Joseph Schon  ( born February 27 , 1954 )  is an American rock guitarist , songwriter , and vocalist , best known for his work with the bands Journey and Bad English ."
87,An investment fund is a way of investing money alongside other investors in order to benefit from the inherent advantages of working as part of a group .
88,"Iraq  (  [ ɪˈræk ]  ,  [ ɪˈrɑːk ]  , or  [ aɪˈræk ]  العراق ; عێراق )  , officially known as the Republic of Iraq is a country in Western Asia , bordered by Turkey to the north , Iran to the east , Kuwait to the southeast , Saudi Arabia to the south , Jordan to the southwest , and Syria to the west ."
89,"Avatar : The Last Airbender is set in an Asiatic-like world in which some people are able to manipulate the classical elements by use of psychokinetic variants of Chinese martial arts , known as `` bending '' ."
90,"He is best known as the lead guitarist of the American rock band Guns N ' Roses , with whom he achieved worldwide success in the late 1980s and early 1990s ."
91,"Paul Samuel Feig  (  [ ˈfiːɡ ]  born September 17 , 1962 )  is an American actor , film director , producer , and screenwriter ."
92,"In 2016 , AWS comprised more than 70 services spanning a wide range including compute , storage , networking , database , analytics , application services , deployment , management , mobile , developer tools , and tools for the Internet of Things ."
93,"David Robert Joseph Beckham ,  (  [ ˈbɛkəm ]  born 2 May 1975 )  is an English former professional footballer ."
94,"Watchmen is an American comic-book limited series published by DC Comics in 1986 and 1987 , and collected in 1987 ."
95,"One by One is the fourth studio album by American rock band Foo Fighters , released on October 22 , 2002 by RCA ."
96,"Rock music is a genre of popular music that originated as `` rock and roll '' in the United States in the early 1950s , and developed into a range of different styles in the 1960s and later , particularly in the United Kingdom and the United States ."
97,"Antonio Lucio Vivaldi  (  [ anˈtɔːnjo ˈluːtʃo viˈvaldi ]  ; 4 March 1678 -- 28 July 1741 )  was an Italian Baroque composer , virtuoso violinist , teacher and cleric ."
98,"He is best known for his vlogs , where he posts updates about his life on a daily basis ."
99,"During pre-production , Raimi originally wanted another villain to be included along with Sandman , but at the request of producer Avi Arad he added Venom , and the producers also requested the addition of Gwen Stacy ."
100,He was knighted by Queen Elizabeth II in July 2000 after receiving Kennedy Center Honors in the US in 1999 .
101,"Blending psychological horror with film noir , the film stars Kyle MacLachlan , Isabella Rossellini , Dennis Hopper and Laura Dern ."
102,"Trained as a civil servant , he entered the country 's House of Representatives in 1943 for the True Whig Party , then the only established party in the country ."
103,"In wider Germanic mythology and paganism , Odin was known in Old English as Wōden , in Old Saxon as Wōdan , and in Old High German as Wuotan or Wōtan , all stemming from the reconstructed Proto-Germanic theonym wōđanaz ."
104,"He subsequently played d'Artagnan in 2011 's The Three Musketeers , starred in the coming-of-age dramas The Perks of Being a Wallflower  ( 2012 )  , Indignation  ( 2016 )  and Sidney Hall  ( 2017 )  , and had major roles in the 2014 films Noah and Fury ."
105,He was named to the All-Rookie team and the All-Star team the following twelve seasons .
106,George VI  ( Albert Frederick Arthur George ; 14 December 1895 -- 6 February 1952 )  was King of the United Kingdom and the Dominions of the British Commonwealth from 11 December 1936 until his death .
107,"Jon Watts  ( born June 28 , 1981 )  is an American film director , producer and screenwriter ."
108,"Seventeen years after beginning his mail bomb campaign , Kaczynski sent a letter to The New York Times on April 24 , 1995 and promised `` to desist from terrorism '' if the Times or The Washington Post published his manifesto , Industrial Society and Its Future  ( the `` Unabomber Manifesto '' )  , in which he argued that his bombings were extreme but necessary to attract attention to the erosion of human freedom necessitated by modern technologies requiring large-scale organization ."
109,"Gone Girl is a 2014 American psychological thriller film directed by David Fincher and written by Gillian Flynn , based on her 2012 novel of the same name ."
110,"Sigmund Freud  (  [ ` frɔɪd ]  ;  [ ˈziːkmʊnt ˈfʁɔʏt ]  ; born Sigismund Schlomo Freud ; 6 May 1856 -- 23 September 1939 )  was an Austrian neurologist and the founder of psychoanalysis , a clinical method for treating psychopathology through dialogue between a patient and a psychoanalyst ."
111,Wonder Woman is a fictional superhero appearing in American comic books published by DC Comics .
112,"He is best known for illustrating the American football manga Eyeshield 21 , in collaboration with writer Riichiro Inagaki ."
113,"He is known for his roles in television as Eric Brady in Days of Our Lives , which earned him several Daytime Emmy Award nominations , as well as Alec/X5 -494 in Dark Angel and Jason Teague in Smallville ."
114,"A hate group is a social group that advocates and practices hatred , hostility , or violence towards members of a race , ethnicity , nation , religion , gender , gender identity , sexual orientation or any other designated sector of society ."
115,"Aishwarya Rai  ( born 1 November 1973 )  , also known by her married name Aishwarya Rai Bachchan , is an Indian actress , model and the winner of the Miss World 1994 pageant ."
116,The character is voiced by Eddie Murphy .
117,"The school offers multiple undergraduate and graduate programs covering production , screenwriting , critical studies , animation and digital arts , and interactive media & games ."
118,Julie Frances Christie  ( born 14 April 1940 )  is an English actress .
119,"Redford 's career began in 1960 as a guest star on numerous TV shows , including : The Untouchables , Perry Mason , Alfred Hitchcock Presents , and The Twilight Zone , among others ."
120,Unforgettable is a 2017 American erotic thriller film directed by Denise Di Novi  ( in her directorial debut )  and written by Christina Hodson and David Leslie Johnson .
121,"Furia is a 1999 French romantic drama film directed by Alexandre Aja , who co-wrote screenplay with Grégory Levasseur , adapted from the science fiction short story `` Graffiti '' by Julio Cortázar ."
122,"At the beginning of her career , Gaga became known for her unconventionality and provocative work ."
123,"Stone Temple Pilots  ( sometimes abbreviated as STP )  are an American rock band from San Diego , California , that originally consisted of Scott Weiland  ( lead vocals )  , brothers Dean  ( guitar )  and Robert DeLeo  ( bass , backing vocals )  , and Eric Kretz  ( drums )  ."
124,"The French Revolution  ( Révolution française  [ ʁevɔlysjɔ̃ fʁɑ̃sɛːz ]  )  was a period of far-reaching social and political upheaval in France that lasted from 1789 until 1799 , and was partially carried forward by Napoleon during the later expansion of the French Empire ."
125,"A seven-time Academy Award nominee , she received her first nomination for They Shoot Horses , Do n't They  ( 1969 )  and went on to win two Best Actress Oscars in the 1970s for Klute  ( 1971 )  and Coming Home  ( 1978 )  ."
126,"King Kong is a 2005 epic monster adventure film co-written , produced , and directed by Peter Jackson ."
127,Winnipeg  (  [ ˈwɪnɪpɛɡ ]  )  is the capital and largest city of the province of Manitoba in Canada .
128,"Throughout his club career , he has only played for teams in Italy , previously playing for Atalanta , Fiorentina , Sampdoria , Internazionale and Milan ."
129,"Steven Vincent Buscemi  (  [ buːˈsɛmi ]  born December 13 , 1957 )  is an American actor and film director ."
130,"Dennis Lee Hopper  ( May 17 , 1936 -- May 29 , 2010 )  was an American actor , filmmaker , photographer and artist ."
131,"A Few Good Men is a 1992 American legal drama film directed by Rob Reiner and starring Tom Cruise , Jack Nicholson , and Demi Moore , with Kevin Bacon , Kevin Pollak , Wolfgang Bodison , James Marshall , J. T. Walsh and Kiefer Sutherland in supporting roles ."
132,She made her screen debut in the Australian drama film For Love Alone  ( 1986 )  and then appeared in the Australian television series Hey Dad .
133,"She released a single from an independent label called `` Swag It Out '' and another single with Bella Thorne called `` Watch Me , '' which is featured on the Break It Down album ."
134,It shares land borders with Scotland to the north and Wales to the west .
135,"Dwyane Tyrone Wade Jr.  (  [ dweɪn ]  ; born January 17 , 1982 )  is an American professional basketball player for the Chicago Bulls of the National Basketball Association  ( NBA )  ."
136,The Hangover Part III is a 2013 American comedy film produced by Legendary Pictures and distributed by Warner Bros. .
137,"Usher Raymond IV  ( born October 14 , 1978 )  is an American singer , songwriter , dancer , and actor ."
138,"His credits include NYPD Blue , ER , 24 , Alias , The Shield , Deadwood , and the documentaries An Inconvenient Truth , The Road We 've Traveled , Waiting for ` Superman ' and He Named Me Malala ."
139,"Margalit Ruth `` Maggie '' Gyllenhaal  (  [ ˈdʒɪlənhɑːl ]  born November 16 , 1977 in New York City )  is an American actress ."
140,"Silicon Valley is a nickname for the southern portion of the San Francisco Bay Area , in the northern part of the U.S. state of California ."
141,"In 2011 , Fanning starred in her breakout role as Alice Dainard in J. J. Abrams ' sci-fi-drama , Super 8 , for which she received a Spotlight Award at the Hollywood Film Festival , and was cited as one of the film 's best aspects by The Telegraph ."
142,"Mark Elliot Zuckerberg  ( born May 14 , 1984 )  is an American computer programmer and Internet entrepreneur ."
143,"Los Angeles  (  [ lɒs ˈændʒəlᵻs ]  , Spanish for `` The Angels '' ;  [ los ˈaŋxeles ]  )  , officially the City of Los Angeles and often known by its initials L.A. , is the cultural , financial , and commercial center of Southern California ."
144,"Eric Singer  ( born Eric Doyle Mensinger ; May 12 , 1958 )  is an American hard rock and heavy metal drummer , best known as a member of Kiss , portraying The Catman originally played by Peter Criss ."
145,"Established on 10 October 1845 , under Secretary of the Navy George Bancroft , it is the second oldest of the United States ' five service academies , and educates officers for commissioning primarily into the United States Navy and United States Marine Corps ."
146,"Lewis Carl Davidson Hamilton , MBE  ( born 7 January 1985 )  is a British Formula One racing driver from England , currently racing for the Mercedes AMG Petronas team ."
147,Timothy Henry `` Tim '' Henman  ( born 6 September 1974 )  is a retired English professional tennis player .
148,"McKenna is the writer of some of Communitys most critically acclaimed episodes , including `` Paradigms of Human Memory '' , `` Conspiracy Theories and Interior Design '' , and the Emmy - and Hugo-nominated `` Remedial Chaos Theory '' ."
149,Kate & Leopold is a 2001 romantic-comedy fantasy that tells a story of a duke who travels through time from New York in 1876 to the present and falls in love with a woman in modern New York .
150,is a Japanese manga and game artist .
151,The Twilight Saga is a series of five romance fantasy films from Summit Entertainment based on the four novels by American author Stephenie Meyer .
