Body ID,articleBody
923,"Formerly a Dutch colony  ( 1638 -- 1710 )  and a French colony  ( 1715 -- 1810 )  , Mauritius became a British colonial possession in 1810 and remained so until 1968 , the year in which it attained independence ."
924,"Kurt Leon Sutter  ( born May 5 , 1960 )  is an American screenwriter , director , producer , and actor ."
925,"The film stars Katherine Heigl , Rosario Dawson , Geoff Stults , Isabella Rice and Cheryl Ladd , and follows a divorcée who begins to torment the new fiancé of her ex-husband ."
926,London  [ ˈlʌndən ]  is the capital and most populous city of England and the United Kingdom .
927,"In the 20th and 21st centuries , mathematicians and computer scientists discovered new approaches that , when combined with increasing computational power , extended the decimal representation of to many trillions of digits after the decimal point ."
928,"David Robert Joseph Beckham ,  (  [ ˈbɛkəm ]  born 2 May 1975 )  is an English former professional footballer ."
929,"Laadla  ( translation : The Beloved Son )  is a Bollywood film released on 17 April 1994 , starring Sridevi , Anil Kapoor and Raveena Tandon ."
930,"Stockard Channing  ( born Susan Antonia Williams Stockard ; February 13 , 1944 )  is an American stage , film and television actress ."
931,"His works explore the relationship between artistic expression , celebrity culture , and advertising that flourished by the 1960s , and span a variety of media , including painting , silkscreening , photography , film , and sculpture ."
932,How to Be is a 2008 independent comedy-drama film written and directed by Oliver Irving .
933,"Elvis Aaron Presley  ( January 8 , 1935 -- August 16 , 1977 )  was an American singer-songwriter and actor ."
934,"Travis Landon Barker  ( born November 14 , 1975 )  is an American musician and producer , and the drummer for the rock band Blink-182 ."
935,"It is based on the DC Comics character Green Arrow , a costumed crime-fighter created by Mort Weisinger and George Papp ."
936,"John Clayton Mayer  (  [ ˈmeɪ.ɚ ]  born October 16 , 1977 )  is an American singer-songwriter , guitarist , and producer ."
937,Futurama is an American animated science fiction sitcom created by Matt Groening for the Fox Broadcasting Company .
938,"`` Radioactive '' is a song by American rock band Imagine Dragons for their major-label debut EP Continued Silence and later on their debut studio album , Night Visions  ( 2012 )  , as the opening track ."
939,Red Headed Stranger is a 1975 album by American outlaw country singer Willie Nelson .
940,Starbucks Corporation is an American coffee company and coffeehouse chain .
941,"Avengers : Age of Ultron premiered in Los Angeles on April 13 , 2015 , and was released on May 1 , 2015 , in North America , in 3D and IMAX 3D ."
942,Indian  ( Tamil : இந்தியன் )  is a 1996 Indian Tamil vigilante crime thriller film written and directed by Shankar and produced by A. M. Rathnam .
943,"Anderson da Silva  (  [ ˈɐ̃deʁsõ ˈsiwvɐ ]  ; born April 14 , 1975 )  is a Brazilian mixed martial artist and former UFC Middleweight Champion ."
944,is a fantasy role-playing video game developed and published by Square Enix for the PlayStation 2 home video console .
945,Hungary  (  [ ˈhʌŋɡəri ]  Magyarország  [ ˈmɒɟɒrorsaːɡ ]  )  is a unitary parliamentary republic in Central Europe .
946,"Richard Tiffany Gere  (  [ ˈɡɪər ]  ; born August 31 , 1949 )  is an American actor and humanitarian activist ."
947,It is a reboot of The Mummy franchise and the first installment in the Dark Universe film series .
948,"The film was nominated for four Academy Awards at the 85th Academy Awards , in the categories Best Picture , Best Director  ( Benh Zeitlin )  , Best Adapted Screenplay  ( Lucy Alibar , Benh Zeitlin )  , and Best Actress  ( Quvenzhané Wallis )  ."
949,"David Robert Jones  ( 8 January 1947 -- 10 January 2016 )  , known professionally as David Bowie  (  [ ˈboʊi ]  )  , was an English singer , songwriter and actor ."
950,"She is also the recipient of ten Grammy Awards , five Guinness World Records , one Emmy Award , 21 Billboard Music Awards , 11 Country Music Association Awards , eight Academy of Country Music Awards , and one Brit Award ."
951,"James Eugene Carrey  (  [ ˈkæri ]  born January 17 , 1962 )  is a Canadian-American actor , comedian , impressionist , screenwriter , and producer ."
952,"It has its roots in 1940s and 1950s rock and roll , a style which drew heavily on the African-American genres of blues and rhythm and blues , and from country music ."
953,"Largely based on Andrew Chaikin 's book , A Man on the Moon , the series is known for its accurate telling of the story of Apollo and the outstanding special effects under visual director Ernest D. Farino ."
954,It is a reboot of The Mummy franchise and the first installment in the Dark Universe film series .
955,"Lisa Nicole Lopes  ( May 27 , 1971 -- April 25 , 2002 )  , better known by her stage name Left Eye , was an American hip hop singer , rapper , actress , songwriter and producer ."
956,"A native of Atlanta , Murphy moved to Los Angeles as a teenager and pursued a career in acting ."
957,"Ford is the second-largest U.S.-based automaker  ( preceded by General Motors )  and the fifth-largest in the world  ( behind Toyota , VW , Hyundai-Kia and General Motors )  based on 2015 vehicle production ."
958,"His second album Exclusive  ( 2007 )  spawned his second Hot 100 number one `` Kiss Kiss '' , in addition to `` With You '' and `` Forever '' ."
959,Google is an American multinational technology company specializing in Internet-related services and products .
960,"Watts directed and co-wrote the upcoming Marvel Studios and Sony Pictures produced Spider-Man : Homecoming , slated for a July 7 , 2017 release ."
961,"The film is a sequel to the 2012 film Prometheus , the second installment in the Alien prequel series , and the sixth installment overall in the Alien film series , as well as the third directed by Scott ."
962,"Hamilton also holds the record for most wins in the season without winning the World Championship , after winning 10 times in the 2016 season where he finished runner-up to teammate Nico Rosberg ."
963,"In 2010 , Hall won a Golden Globe Award and a Screen Actors Guild Award for his role in Dexter ."
964,"Keanu Charles Reeves  (  [ kiːˈɑːnuː ]  ; born September 2 , 1964 )  is a Canadian actor , director , producer , and musician ."
965,"Whiskey Tango Foxtrot is a 2016 American biographical war comedy-drama film directed by Glenn Ficarra and John Requa , and written by Robert Carlock , based on the memoir The Taliban Shuffle : Strange Days in Afghanistan and Pakistan by Kim Barker ."
966,"He is noted for his roles in five feature-length films : Lo Wei 's The Big Boss  ( 1971 )  and Fist of Fury  ( 1972 )  ; Golden Harvest 's Way of the Dragon  ( 1972 )  , directed and written by Lee ; Golden Harvest and Warner Brothers ' Enter the Dragon  ( 1973 )  and The Game of Death  ( 1978 )  , both directed by Robert Clouse ."
967,"The film stars Tina Fey , Margot Robbie , Martin Freeman , Christopher Abbott , Alfred Molina , and Billy Bob Thornton ."
968,"The film stars Daniel Kaluuya , Allison Williams , Lil Rel Howery , Bradley Whitford , Caleb Landry Jones , Stephen Root and Catherine Keener , and follows a young interracial couple who visit the mysterious estate of the woman 's parents ."
969,"Holley was born in Lubbock , Texas , to a musical family during the Great Depression ; he learned to play guitar and to sing alongside his siblings ."
970,"Since the Hopman Cup was founded in 1989 , it has been attended each year by Harry Hopman 's widow , his second wife Lucy , who travels to the tournament annually from her home in the United States ."
971,"He is often called England 's national poet , and the `` Bard of Avon '' ."
972,"Soon after he launched his first high-end restaurant , Jamie 's Italian , in Oxford in 2008 and hosted a TED Talk winning him the 2010 TED Prize ."
973,"Thomas B. Kin Chong  ( born May 24 , 1938 )  is a Canadian-American comedian and actor , who is known for his marijuana-themed Cheech & Chong comedy albums and movies with Cheech Marin , as well as playing the character Leo on Fox 's That '70s Show ."
974,"Jerry Lewis  ( born Joseph Levitch ; March 16 , 1926 )  is an American actor , comedian , singer , film producer , film director , screenwriter and humanitarian ."
975,"His net worth is estimated to be US$ 63.3 billion as of May 2017 , and he is ranked by Forbes as the fifth richest person in the world ."
976,"Evil , in a general context is the absence or opposite of that which is described as being good ."
977,"The group consisted of guitarist Jimmy Page , singer Robert Plant , bassist and keyboardist John Paul Jones , and drummer John Bonham ."
978,"James D. `` Jim '' Grant  ( born 29 October 1954 )  , better known by his pen name Lee Child , is a British author who writes thriller novels ."
979,"Charles , Prince of Wales  ( Charles Philip Arthur George ; born 14 November 1948 )  is the eldest child and heir apparent of Queen Elizabeth II ."
980,"Sherman-Palladino , her husband Daniel Palladino , David S. Rosenthal , and Gavin Polone served as the executive producers ."
981,He frequently works with Joel Cohen .
982,"David Robert Joseph Beckham ,  (  [ ˈbɛkəm ]  born 2 May 1975 )  is an English former professional footballer ."
983,"Daniel Michael DeVito , Jr.  ( born November 17 , 1944 )  is an American actor , comedian , director and producer ."
984,"Three of his early hits later won Grammy Hall of Fame Awards  ( 2000 , 2004 , 2008 )  , while Campbell himself won the Grammy Lifetime Achievement Award in 2012 ."
985,"Winona Ryder  ( born Winona Laura Horowitz ; October 29 , 1971 )  is an American actress ."
986,He was one of the thirteen men who founded Juventus in 1897 and the club 's first ever president .
987,"The iPhone 3G is internally similar to its predecessor , but included several new hardware features , such as GPS , 3G data and tri-band UMTS/HSDPA ."
988,"After the split of his first band , Feeble , Barker began playing for the Aquabats in 1996 as the Baron Von Tito ."
989,The play was previously made into the silent movie Easy Virtue  ( 1928 )  by Alfred Hitchcock .
990,The film is a loose reworking of Federico Fellini 's 1965 film Juliet of the Spirits .
991,"Andre Kirk Agassi  (  [ ˈɑːndreɪ ˈæɡəsi ]  born April 29 , 1970 )  is an American retired professional tennis player and former World No. 1 who was one of the sport 's most dominant players from the early 1990s to the mid-2000s ."
992,"Huntington 's disease  ( HD )  , also known as Huntington 's chorea , is an inherited disorder that results in death of brain cells ."
993,"Injustice 2 introduces a new feature called the Gear System , a loot-dropping system that rewards players with costume pieces and equipment that can be used to customize characters ' appearances and modify their abilities and stats ."
994,His most commercially successful role to date has been that of Remus Lupin in the Harry Potter film series .
995,Emily Jane Browning  ( born 7 December 1988 )  is an Australian actress and singer .
996,"Gerard Anthony `` Tony '' Bill  ( born August 23 , 1940 )  is an American actor , producer , and director ."
997,"Kuala Lumpur  (  [ ˈkwɑːlə ˈlʊmpʊə ]  or  [ - pər ]   [ ˈkwalə ˈlumpʊr ]  )  , officially the Federal Territory of Kuala Lumpur , or more commonly KL , is the national capital of Malaysia as well as its largest city ."
998,"Her other film roles included Shampoo  ( 1975 )  , The Blues Brothers  ( 1980 )  , Hannah and Her Sisters  ( 1986 )  , The ` Burbs  ( 1989 )  , and When Harry Met Sally ...  ( 1989 )  ."
999,Led Zeppelin were an English rock band formed in London in 1968 .
1000,"Carrie Frances Fisher  ( October 21 , 1956 -- December 27 , 2016 )  was an American actress , writer and humorist who first became known for playing Princess Leia in the Star Wars film series ."
1001,"Robert Francis `` Bobby '' Kennedy  ( November 20 , 1925 -- June 6 , 1968 )  , commonly known by his initials RFK , was an American politician from Massachusetts ."
1002,"Evan Rachel Wood  ( born September 7 , 1987 )  is an American actress and musician ."
1003,"It is located in the Cusco Region , Urubamba Province , Machupicchu District in Peru , above the Sacred Valley , which is 80 km northwest of Cuzco and through which the Urubamba River flows ."
1004,She also has won 12 singles and 14 doubles titles on the ITF Women 's Circuit .
1005,"The French Revolution  ( Révolution française  [ ʁevɔlysjɔ̃ fʁɑ̃sɛːz ]  )  was a period of far-reaching social and political upheaval in France that lasted from 1789 until 1799 , and was partially carried forward by Napoleon during the later expansion of the French Empire ."
1006,`` Here Comes the Sun '' is a song written by George Harrison that was first released on the Beatles ' 1969 album Abbey Road .
1007,"Frederick Christ Trump  ( October 11 , 1905 -- June 25 , 1999 )  was an American real estate developer and philanthropist , primarily in New York City , and father of Donald Trump , the 45th President of the United States , and Maryanne Trump Barry , a United States Court of Appeals judge ."
1008,"Dolly Rebecca Parton Dean  ( born January 19 , 1946 )  , professionally known as Dolly Parton , is an American singer , songwriter , multi-instrumentalist , record producer , actress , author , businesswoman , and philanthropist , known primarily for her work in country music ."
1009,"Stephen Ray Vaughan  ( October 3 , 1954 -- August 27 , 1990 )  was an American musician , singer , songwriter , and record producer ."
1010,"By 1933 , the Nazi Party was the largest elected party in the German Reichstag , which led to Hitler 's appointment as Chancellor on 30 January 1933 ."
1011,"In 2013 , he appeared in Kick-Ass 2 as Colonel Stars and Stripes ."
1012,"`` Live Your Life '' is a song by American rapper T.I. , from his sixth studio album , Paper Trail  ( 2008 )  , and features Barbadian singer Rihanna ."
1013,"The band experienced multiple line-up changes , with Iommi being the only constant member throughout its history ."
1014,"A seven-time Academy Award nominee , she received her first nomination for They Shoot Horses , Do n't They  ( 1969 )  and went on to win two Best Actress Oscars in the 1970s for Klute  ( 1971 )  and Coming Home  ( 1978 )  ."
1015,Montreal  (  [ audio = Montreal-English-pronunciation .
1016,"Lee Min-ho  ( , born June 22 , 1987 )  is a South Korean actor and singer ."
1017,"Deadpool is a 2016 American superhero film directed by Tim Miller and written by Rhett Reese and Paul Wernick , based on the Marvel Comics character of the same name ."
1018,Blunt made her professional debut in a 2001 London production of the play The Royal Family .
1019,is a Japanese media franchise created by Akira Toriyama .
1020,"Matthew William `` Matt '' Sorum  ( born November 19 , 1960 )  is an American drummer and percussionist ."
1021,"William Jefferson Clinton  ( born August 19 , 1946 )  is an American politician who served as the 42nd President of the United States from 1993 to 2001 ."
1022,"In 1990 , she rose to fame with the release of `` Vision of Love '' from her eponymous debut album ."
1023,"Joan Cusack  (  [ ˈkjuːsæk ]  , born October 11 , 1962 )  is an American actress ."
1024,"Jennifer Kate Hudson  ( born September 12 , 1981 )  is an American singer , actress and spokesperson ."
1025,"In 2006 , the United States Library of Congress deemed this film `` culturally , historically , or aesthetically significant '' , and selected it for preservation in the National Film Registry , saying `` the plot of a trek along the Oregon Trail is aided immensely by the majestic sweep provided by the experimental Grandeur wide-screen process used in filming '' ."
1026,"Most of his work has been in the hard rock and alternative metal styles , though he trained in jazz guitar and has substantial connections with avant-garde music and film soundtrack composition ."
1027,"The film stars Hugh Jackman as Robert Angier , Christian Bale as Alfred Borden , and David Bowie as Nikola Tesla ."
1028,"Star Search is an American television show that was produced by T.P.E. / Rysher Entertainment from 1983 to 1995 , hosted by Ed McMahon , and created by Alfred Masini ."
1029,"The Conjuring 2 is a 2016 American horror film directed by James Wan and written by Carey Hayes , Chad Hayes , Wan and David Leslie Johnson ."
1030,"William James `` Count '' Basie  ( August 21 , 1904 -- April 26 , 1984 )  was an American jazz pianist , organist , bandleader , and composer ."
1031,"Steven Paul Jobs  (  [ ˈdʒɒbz ]  February 24 , 1955 -- October 5 , 2011 )  was an American entrepreneur , businessman , inventor , and industrial designer ."
1032,"The film stars the voices of Jay Baruchel , Gerard Butler , Craig Ferguson , America Ferrera , Jonah Hill , T.J. Miller , Kristen Wiig , and Christopher Mintz-Plasse ."
1033,The Great Debaters is a 2007 American biographical drama film directed by and starring Denzel Washington .
1034,"The band , which was one of the first `` super-groups '' , released their only album , Blind Faith , in August 1969 ."
1035,Ceres  (  [ ˈsɪəriːz ]  minor-planet designation : 1 Ceres )  is the largest object in the asteroid belt that lies between the orbits of Mars and Jupiter .
1036,"Ulysses S. Grant  ( born Hiram Ulysses Grant ; April 27 , 1822 -- July 23 , 1885 )  was the 18th President of the United States  ( 1869 -- 77 )  ."
1037,The Black Dahlia is a 2006 French-American neo-noir crime thriller film directed by Brian De Palma and written by Josh Friedman .
1038,"The series is set in Atlantic City , New Jersey during the Prohibition era and stars Steve Buscemi as Nucky Thompson ."
1039,Caryn Mandabach is an American television producer .
1040,"In 1984 she made her first mainstream appearance as Zula in the fantasy-action film Conan the Destroyer alongside Arnold Schwarzenegger and Sarah Douglas , and subsequently appeared in the 1985 James Bond movie A View to a Kill as May Day ."
1041,"He subsequently played d'Artagnan in 2011 's The Three Musketeers , starred in the coming-of-age dramas The Perks of Being a Wallflower  ( 2012 )  , Indignation  ( 2016 )  and Sidney Hall  ( 2017 )  , and had major roles in the 2014 films Noah and Fury ."
1042,"It was an instant blockbuster , grossing $ 533.3 million worldwide over a $ 180 million budget , receiving overwhelming acclaim from critics and winning the 2008 Golden Globe Award for Best Animated Feature Film , the 2009 Hugo Award for Best Long Form Dramatic Presentation , the final Nebula Award for Best Script , the Saturn Award for Best Animated Film and the Academy Award for Best Animated Feature with five nominations ."
1043,"Austria  ( listen )  , is a federal republic and a landlocked country of over 8.7 million people in Central Europe ."
1044,"Cyrus starred in the feature film Hannah Montana : The Movie , and began cultivating a more mature image with her EP The Time of Our Lives in 2009 ."
1045,"Kazakhstan  (  [ USkæzækˈstæn ,   ˌkɑːzɑːkˈstɑːn ]  ,  [ ˌkæzəkˈstɑːn ,   - ˈstæn ]  Қазақстан , tr ."
1046,The screenplay was by Robert Bolt and it was based on the book Captain Bligh and Mr. Christian  ( 1972 )  by Richard Hough .
1047,Xbox One is a line of home video game consoles developed by Microsoft .
1048,Trolls is a 2016 American 3D computer-animated musical romantic comedy adventure film based on the Troll dolls created by Thomas Dam .
1049,She is known for playing Betty Rizzo in the film Grease  ( 1978 )  and First Lady Abbey Bartlet on the NBC television series The West Wing  ( 1999 -- 2006 )  .
1050,"The series is based on A Game of Thrones , the first novel in the A Song of Ice and Fire series by George R. R. Martin , adapted for television by David Benioff and D. B. Weiss ."
1051,"Alexander Hamilton  ( January 11 , 1755 or 1757July 12 , 1804 )  was an American statesman and one of the Founding Fathers of the United States ."
1052,"From 1999 , Gaddafi rejected Arab socialism and encouraged economic privatisation , rapprochement with Western nations , and Pan-Africanism ; he was Chairperson of the African Union from 2009 -- 10 ."
1053,"His career began in the late 1980s , when he wrote and directed My Best Friend 's Birthday , the screenplay of which formed the basis for True Romance ."
1054,"Written by Glenn German and Adam Rodgers , the film follows a man and a woman as they meet and fall in love while taking their children on a college tour ."
1055,"John Devon Roland Pertwee  ( 7 July 1919 -- 20 May 1996 )  , known professionally as Jon Pertwee , was an English actor , entertainer and cabaret performer ."
1056,"After beginnings in dance and modeling , she turned her attention to acting , and made her American acting debut  ( and came to prominence in what would be a Golden Globe -- nominated role )  in her portrayal of Tonya in David Lean 's Doctor Zhivago  ( 1965 )  ."
1057,Elephants are large mammals of the family Elephantidae and the order Proboscidea .
1058,Gang Signs & Prayer is the debut studio album by English grime artist Stormzy .
1059,"Moscow is the capital and most populous city of Russia , with 13.2 million residents within the city limits and 17.8 million within the urban area ."
1060,Star Trek is an American science fiction media franchise based on the television series created by Gene Roddenberry .
1061,"The series follows cult science fiction actor Wray Nerely  ( Tudyk )  , as he tours the convention circuit ."
1062,"Christopher Brian `` Chris '' Bridges  ( born September 11 , 1977 )  , better known by his stage name Ludacris , is an American hip hop recording artist and actor ."
1063,She is the daughter of producer Beryl Vertue .
1064,"Respublika Kazakhstan )  , is a transcontinental country in northern Central Asia and Eastern Europe ."
1065,"Her credits include the roles of FBI Special Agent Dana Scully in the long-running and widely popular series The X-Files , ill-fated socialite Lily Bart in Terence Davies ' film The House of Mirth  ( 2000 )  , and DSI Stella Gibson on the BBC crime drama television series The Fall ."
1066,He became a naturalized United States citizen in the late 1980s .
1067,"There are many subtypes of ANAs such as anti-Ro antibodies , anti-La antibodies , anti-Sm antibodies , anti-nRNP antibodies , anti-Scl-70 antibodies , anti-dsDNA antibodies , anti-histone antibodies , antibodies to nuclear pore complexes , anti-centromere antibodies and anti-sp100 antibodies ."
1068,"Mel Colmcille Gerard Gibson  ( born January 3 , 1956 )  is an American actor and filmmaker ."
1069,"Standing on the River Thames in the south east of the island of Great Britain , London has been a major settlement for two millennia ."
1070,"According to the United States Federal Bureau of Investigation  ( FBI )  , a hate group 's `` primary purpose is to promote animosity , hostility , and malice against persons belonging to a race , religion , disability , sexual orientation , or ethnicity/national origin which differs from that of the members of the organization . ''"
1071,"Tanzania  [ ˌtænzəˈniːə ]  , officially the United Republic of Tanzania  ( Jamhuri ya Muungano wa Tanzania )  , is a country in Eastern Africa within the African Great Lakes region ."
1072,"`` Radioactive '' is a song by American rock band Imagine Dragons for their major-label debut EP Continued Silence and later on their debut studio album , Night Visions  ( 2012 )  , as the opening track ."
1073,"Charles Marie de La Condamine  ( 28 January 1701 -- 13 February 1774 )  was a French explorer , geographer , and mathematician ."
1074,"Caryn Elaine Johnson  ( born November 13 , 1955 )  , known professionally as Whoopi Goldberg  (  [ ˈwhʊpi ]  )  , is an American actress , comedian , author and television host ."
1075,"In 2015 , Down syndrome was present in 5.4 million individuals and resulted in 27,000 deaths down from 43,000 deaths in 1990 ."
1076,"The songs can be sequential , or by beatmatching the songs and creating overlaps and fades between the end of one song and the beginning of another the tape may become a seamless whole ."
1077,"Soundgarden is an American rock band formed in Seattle , Washington , in 1984 by singer and rhythm guitarist Chris Cornell , lead guitarist Kim Thayil , and bassist Hiro Yamamoto ."
1078,"Snowden is a 2016 American-German biographical political thriller film directed by Oliver Stone and written by Stone and Kieran Fitzgerald , based on the books The Snowden Files by Luke Harding and Time of the Octopus by Anatoly Kucherena ."
1079,"The film was widely acclaimed by critics , who praised the animation 's technical innovation , the wit and thematic sophistication of the screenplay , and the performances of Hanks and Allen ."
1080,"Born and raised in the Southeastern United States , Turner relinquished her American citizenship after obtaining Swiss citizenship in 2013 ."
1081,"He is Journey 's last original constant member , having participated in every album and tour to date ."
1082,"Robert Sylvester Kelly  ( born January 8 , 1967 )  , known professionally as R. Kelly , is an American singer , songwriter , record producer , and former professional basketball player ."
1083,"He has won seven times on the PGA Tour , with these wins spanning over 12 years ."
1084,"Except in military defence and foreign affairs , Hong Kong maintains its independent executive , legislative and judiciary powers ."
1085,"The Crazies is a 2010 American science fiction horror film directed by Breck Eisner , with a screenplay by Scott Kosar and Ray Wright ."
1086,"Adapted from the 1997 short story of the same name by Annie Proulx , the screenplay was written by Ossana and Larry McMurtry ."
