Body ID,articleBody
2784,Other notable roles include her portrayal of the title character in the true crime drama Amanda Knox : Murder on Trial in Italy and Kirby Reed in the slasher film Scream 4 .
2785,"The series revolves around two brothers , one of whom has been sentenced to death for a crime he did not commit , and the other who devises an elaborate plan to help his brother escape prison and clear his name ."
2786,"It is a network of networks that consists of private , public , academic , business , and government networks of local to global scope , linked by a broad array of electronic , wireless , and optical networking technologies ."
2787,"George Edward Foreman  ( born January 10 , 1949 )  is an American former professional boxer who competed from 1969 to 1977 , and from 1987 to 1997 ."
2788,"Alicia Augello Cook  ( born January 25 , 1981 )  , known professionally as Alicia Keys , is an American singer , songwriter , record producer , pianist and actress ."
2789,"From 1999 to 2002 , Heigl co-starred as Isabel Evans on the television series Roswell ."
2790,"Google was founded in 1998 by Larry Page and Sergey Brin while they were Ph.D. students at Stanford University , in California ."
2791,"The region is traditionally described as eight counties , based on demographics and economic ties : Imperial , Los Angeles , Orange , Riverside , San Bernardino , San Diego , Santa Barbara , and Ventura ."
2792,`` Timber '' is a song by American rapper Pitbull featuring American recording artist Kesha .
2793,"Francis Ford Coppola  (  [ pronˈkoʊpələ ]  born April 7 , 1939 )  , also credited as Francis Coppola , is a semi-retired American film director , producer , and screenwriter ."
2794,"Patrick Joseph Wilson  ( born July 3 , 1973 )  is an American actor and singer ."
2795,"Currently signed to WWE on a part-time contract , Johnson gained mainstream fame in the World Wrestling Federation  ( WWF , now WWE )  from 1996 to 2004 as a major figure in the company 's Attitude Era , and was the first third-generation wrestler in the company 's history ."
2796,"It depicts the adventures of various characters `` a long time ago in a galaxy far , far away '' ."
2797,"The Great Waldo Pepper is a 1975 American drama film directed , produced , and co-written by George Roy Hill ."
2798,"His work has had a considerable influence on mathematics , logic , set theory , linguistics , artificial intelligence , cognitive science , computer science  ( see type theory and type system )  , and philosophy , especially the philosophy of language , epistemology , and metaphysics ."
2799,"The film stars Seann William Scott , Paul Rudd , Christopher Mintz-Plasse , Bobb ' e J. Thompson , Jane Lynch and Elizabeth Banks ."
2800,"Marie Skłodowska Curie  (  [ ˈkjʊri ,   kjʊˈriː ]   [ kyʁi ]  ;  [ kʲiˈri ]  ; 7 November 18674 July 1934 )  , born Maria Salomea Skłodowska  (  [ ˈmarja salɔˈmɛa skwɔˈdɔfska ]  )  , was a Polish and naturalized-French physicist and chemist who conducted pioneering research on radioactivity ."
2801,"He became known among younger audiences as Louis Stevens in the Disney Channel series Even Stevens , a role for which LaBeouf received a Young Artist Award nomination in 2001 and won a Daytime Emmy Award in 2003 ."
2802,"Melanie Richards Griffith  ( born August 9 , 1957 )  is an American actress ."
2803,"It was an instant blockbuster , grossing $ 533.3 million worldwide over a $ 180 million budget , receiving overwhelming acclaim from critics and winning the 2008 Golden Globe Award for Best Animated Feature Film , the 2009 Hugo Award for Best Long Form Dramatic Presentation , the final Nebula Award for Best Script , the Saturn Award for Best Animated Film and the Academy Award for Best Animated Feature with five nominations ."
2804,David Tennant  ( born David John McDonald ; 18 April 1971 )  is a Scottish actor and voice actor .
2805,"Radiohead are an English alternative rock band from Abingdon , Oxfordshire , formed in 1985 ."
2806,"Adrian Molina  ( born August 23 , 1985 )  is an American screenwriter and storyboard artist ."
2807,"It 's Always Sunny in Philadelphia is an American television black comedy sitcom that premiered on FX on August 4 , 2005 ."
2808,"Rajon Pierre Rondo  ( born February 22 , 1986 )  is an American professional basketball player for the Chicago Bulls of the National Basketball Association  ( NBA )  ."
2809,Keys made her film debut in Smokin ' Aces and has also appeared in The Nanny Diaries and The Secret Life of Bees .
2810,Jane Austen 's Emma is an adaptation of the 1815 novel of the same name .
2811,"It was co-founded by filmmaker Grigorij Richters , B612 Foundation COO Danica Remy , Apollo 9 astronaut Rusty Schweickart and Brian May , Queen guitarist and astrophysicist ."
2812,"The single eventually earned gold certifications in countries including Australia , Belgium , Sweden and the US ."
2813,"Jennifer Joanna Aniston  ( born February 11 , 1969 )  is an American actress , producer , and businesswoman ."
2814,Red is a 2010 American action comedy film inspired by the limited comic book series of the same name created by Warren Ellis and Cully Hamner and published by the DC Comics imprint Homage .
2815,"Tyra Lynne Banks  ( born December 4 , 1973 )  is an American television personality , producer , businesswoman , actress , author , former model and occasional singer ."
2816,"Elizabeth II  ( Elizabeth Alexandra Mary ; born 21 April 1926 )  has been Queen of the United Kingdom , Canada , Australia , and New Zealand since 6 February 1952 ."
2817,"Theodore John Kaczynski  (  [ kəˈzɪnski ]  born May 22 , 1942 )  , also known as the `` Unabomber '' , is an American serial killer , domestic terrorist , and self-professed anarchist ."
2818,"The production company makes TV shows like truTV 's Billy on the Street , Comedy Central 's @midnight , and Zach Galifianakis 's popular Emmy-winning web series Between Two Ferns ."
2819,"It is the tallest building in the Western Hemisphere , and the sixth-tallest in the world ."
2820,She is a currently playing the lead role of Pragya in Zee TV 's show Kumkum Bhagya .
2821,"Cher  (  [ ˈʃɛər ]  born Cherilyn Sarkisian , May 20 , 1946 )  is an American singer and actress ."
2822,"Led Zeppelin II is the eponymous second studio album by the English rock band Led Zeppelin , released on 22 October 1969 in the United States and on 31 October 1969 in the United Kingdom by Atlantic Records ."
2823,"Chester Charles Bennington  ( born March 20 , 1976 )  is an American musician , singer , songwriter and actor ."
2824,"At the time of its release it was the most expensive European film ever made , and it remained the highest-grossing French film at the international box office until the release of The Intouchables in 2011 ."
2825,"Taal  ( English : Rhythm )  is a 1999 Bollywood musical romantic drama film co written , edited , produced and directed by Subhash Ghai ."
2826,Henry Walton `` Indiana '' Jones Jr.  ( also shortened to Indy )  is a fictional character and the protagonist of the Indiana Jones franchise .
2827,My Summer of Love is a 2004 British drama film directed by Pawel Pawlikowski and co-written by Pawlikowski and Michael Wynne .
2828,"`` California Gurls '' is a song recorded by American singer Katy Perry for her third studio album , Teenage Dream  ( 2010 )  ."
2829,"Close began her professional stage career in 1974 in Love for Love , and was mostly a New York stage actress through the rest of the 1970s and early 1980s , appearing in both plays and musicals , including the Broadway productions of Barnum in 1980 and The Real Thing in 1983 , for which she won the Tony Award for Best Actress in a Play ."
2830,"His fourth studio album Purpose was released in November 2015 , spawning three number one singles : `` What Do You Mean ? ''"
2831,"It includes the major cities of Boston , Providence , Hartford , New York City , Philadelphia , Baltimore , and Washington , D.C. , along with their metropolitan areas and suburbs as well as many smaller urban centers ."
2832,"Except for a brief absence in 1988 , he was with the band from its November 1973 beginning until retiring permanently in 2014 , due to health reasons ."
2833,"Lee Jun-fan  ( ; November 27 , 1940 -- July 20 , 1973 )  , known professionally as Bruce Lee , was a Hong Kong and American martial artist , actor , philosopher , filmmaker , and founder of the martial art Jeet Kune Do ."
2834,"For her portrayal of the French singer Édith Piaf in the biopic La Vie en Rose  ( 2007 )  , Cotillard achieved worldwide recognition and won her second César Award , a BAFTA Award , a Golden Globe Award , a Lumières Award and the Academy Award for Best Actress , becoming the first and  ( as of 2017 )  only actor to win an Academy Award for a performance in French , and also the second actress and one of only six actors to have won this award for a part spoken in a foreign language ."
2835,"Lily Chloe Ninette Thomson  ( born 5 April 1989 )  , known as Lily James , is an English actress ."
2836,"James Eugene Carrey  (  [ ˈkæri ]  born January 17 , 1962 )  is a Canadian-American actor , comedian , impressionist , screenwriter , and producer ."
2837,Little Mix are a British girl group formed in 2011 during the eighth series of the UK version of The X Factor .
2838,"Madonna Louise Ciccone  (  [ tʃɪˈkoʊni ]  born August 16 , 1958 )  is an American singer , songwriter , actress , and businesswoman ."
2839,"Stefanie Maria `` Steffi '' Graf  (  [ ˈʃtɛfiː ˈgʁa : f ]  ; born 14 June 1969 )  is a German former tennis player , who was ranked world No. 1 during her career ."
2840,"Starring Dan Stevens , Maika Monroe , Leland Orser , Sheila Kelley , Brendan Meyer , and Lance Reddick , the plot follows a soldier named `` David '' unexpectedly visiting the Peterson family , introducing himself as a friend of their son who had died during the Afghanistan war ."
2841,"In 2013 , he portrayed Perry White in the Zack Snyder-directed Superman reboot Man of Steel and in 2016 reprised his role in Batman v Superman : Dawn of Justice ."
2842,"The Lion King tells the story of Simba , a young lion who is to succeed his father , Mufasa , as King of the Pride Lands ; however , after Simba 's uncle Scar murders Mufasa , Simba is manipulated into thinking he was responsible and flees into exile ."
2843,"Edwards began his career in the 1940s as an actor , but he soon began writing screenplays and radio scripts before turning to producing and directing in television and films ."
2844,Gift of the Night Fury is a 2011 computer-animated short film by DreamWorks Animation and directed by Tom Owens .
2845,"A red , flat rash which usually starts on the face and then spreads to the rest of the body typically begins three to five days after the start of symptoms ."
2846,"Ruth Negga  (  [ ˈneɪgə ]  born 7 January 1982 )  is an Ethiopian born Irish actress , who has appeared in the films Capital Letters  ( 2004 )   ( also released as Trafficked in some countries )  , Isolation  ( 2005 )  , Breakfast on Pluto  ( 2005 )  and Warcraft  ( 2016 )  ."
2847,"Dennis Lee Hopper  ( May 17 , 1936 -- May 29 , 2010 )  was an American actor , filmmaker , photographer and artist ."
2848,"David Lawrence Schwimmer  ( born November 2 , 1966 )  is an American actor , director , and producer ."
2849,Paul Labile Pogba  ( born 15 March 1993 )  is a French professional footballer who plays for Premier League club Manchester United and the France national team .
2850,Richard St John Harris  ( 1 October 1930 -- 25 October 2002 )  was an Irish actor and singer .
2851,Gemma Christina Arterton  ( born 2 February 1986 )  is an English actress .
2852,Emily Olivia Leah Blunt  ( born 23 February 1983 )  is a British film and stage actress .
2853,The album was not as successful as her albums with the Spice Girls or that of other members solo albums released around this time .
2854,"In addition to his solo commercial success , Brown has been featured on several singles such as `` No Air '' , a duet with singer Jordin Sparks , `` Shortie like Mine '' with the rapper Bow Wow and `` Shawty Get Loose '' alongside Lil Mama and T-Pain ."
2855,"Ecuador  (  [ ˈɛkwədɔːr ]  ,  [ ekwaˈðor ]  )   ( Ikwadur )  , officially the Republic of Ecuador  (  [ República del Ecuador , ]  , which literally translates as `` Republic of the Equator '' ; Ikwadur Ripuwlika )  , is a representative democratic republic in northwestern South America , bordered by Colombia on the north , Peru on the east and south , and the Pacific Ocean to the west ."
2856,"Gopalkrishna Devdas Gandhi  ( born April 22 , 1946 )  is a retired IAS officer and diplomat , who was the 22nd Governor of West Bengal serving from 2004 to 2009 ."
2857,"The country is host to the Organisation for the Prohibition of Chemical Weapons and five international courts : the Permanent Court of Arbitration , the International Court of Justice , the International Criminal Tribunal for the Former Yugoslavia , the International Criminal Court and the Special Tribunal for Lebanon ."
2858,He is known for his powerful baritone vocals .
2859,The brown bear  ( Ursus arctos )  is a large bear with the widest distribution of any living ursid .
2860,"Production for the album took place during 2002 to 2003 and was handled by Winehouse , Salaam Remi , Gordon `` Commissioner Gordon '' Williams , Jimmy Hogarth and Matt Rowe ."
2861,"She also portrayed Veronica Palmer on the ABC television sitcom Better Off Ted , and Olivia Lord on the television drama Nip/Tuck ."
2862,"His other works contributed include The Crazies , Creepshow , Martin , Monkey Shines , and The Dark Half ."
2863,"Remote Control Productions has been responsible for the scores for a number of successful live-action films including the Pirates of the Caribbean movies , Iron Man , Gladiator , Mission : Impossible 2 , The Last Samurai , Transformers , Hancock , Kingdom of Heaven , The Da Vinci Code , Inception , Sherlock Holmes and its sequel , and The Dark Knight Trilogy , along with successful animated films such as the Shrek series , Kung Fu Panda , Madagascar , The Lion King , and more ."
2864,"Robert Chase , MBBS is a fictional character on the Fox medical drama House ."
2865,"The group 's original lineup consisted of brothers Brian , Dennis , and Carl Wilson ; their cousin Mike Love ; and their friend Al Jardine ."
2866,"The cast also includes Margot Kidder , Bo Svenson , Edward Herrmann and Susan Sarandon ."
2867,"Sir Robert Bryson Hall II  ( born January 22 , 1990 )  , known by his stage name Logic , is an American rapper , singer , songwriter , and record producer ."
2868,"She was born in Skopje  ( now the capital of the Republic of Macedonia )  , then part of the Kosovo Vilayet of the Ottoman Empire ."
2869,"Benjamin Geza Affleck-Boldt  ( born August 15 , 1972 )  is an American actor and filmmaker ."
2870,He garnered a nomination for the Filmfare Award for Best Actor for portraying an avenger in the crime thriller Badlapur  ( 2015 )  .
2871,Boston  ( pronounced  [ ˈbɒstən ]  )  is the capital and most populous city of the Commonwealth of Massachusetts in the United States .
2872,Arnold Vinick is a fictional character on the television series The West Wing played by Alan Alda .
2873,"The film was directed by Mike Mitchell and co-directed by Walt Dohrn , written by Jonathan Aibel and Glenn Berger and based on a story by Erica Rivinoja ."
2874,Robin is the name of several fictional superheroes appearing in American comic books published by DC Comics .
2875,"Kobe Bean Bryant  ( born August 23 , 1978 )  is an American retired professional basketball player and businessman ."
2876,"The picture centers on the life and career of John Reed , the journalist and writer who chronicled the Russian Revolution in his book Ten Days That Shook the World ."
2877,"Klute is a 1971 American neo-noir crime-thriller film directed and produced by Alan J. Pakula , written by Andy and Dave Lewis , and starring Jane Fonda , Donald Sutherland , Charles Cioffi , and Roy Scheider ."
2878,"He first established himself in the mid-1990s as a cast member on the NBC sketch comedy show Saturday Night Live , and has subsequently starred in comedy films such as Anchorman : The Legend of Ron Burgundy  ( 2004 )  , Talladega Nights  ( 2006 )  , Step Brothers  ( 2008 )  , The Other Guys  ( 2010 )  and Anchorman 2 : The Legend Continues  ( 2013 )  , all but one of which he co-wrote with his comedy partner Adam McKay ."
2879,"Both the Duke of Kent and King George III died in 1820 , and Victoria was raised under close supervision by her German-born mother Princess Victoria of Saxe-Coburg-Saalfeld ."
2880,Albany  (  [ ˈɔːlbəni ]  )  is the capital of the U.S. state of New York and the seat of Albany County .
2881,"His debut album , Rappa Ternt Sanga , was released in 2005 ."
2882,"Asset management , broadly defined , refers to any system that monitors and maintains things of value to an entity or group ."
2883,"Rock music is a genre of popular music that originated as `` rock and roll '' in the United States in the early 1950s , and developed into a range of different styles in the 1960s and later , particularly in the United Kingdom and the United States ."
2884,"Hilda Roderick Ellis Davidson  ( born Hilda Roderick Ellis , 1 October 1914 -- January 2006 )  was an English antiquarian and academic , writing in particular on Germanic paganism and Celtic paganism ."
2885,He is currently playing a District Attorney named Blake Tower in the Marvel 's series Daredevil .
2886,"During his career , McGregor has competed as a featherweight , lightweight , and welterweight ."
2887,"Rossum has starred in movies including Songcatcher  ( 2000 )  , An American Rhapsody ,  ( 2001 )  and Passionada  ( 2002 )  ."
2888,"Later , it was remixed by Rock Mafia and released on August 25 , 2008 by Hollywood Records , as the second single from Cyrus ' second studio album , Breakout  ( 2008 )  ."
2889,"Halle Maria Berry  ( born Maria Halle Berry ; August 14 , 1966 )  is an American actress ."
2890,"Prison Break is an American television serial drama created by Paul Scheuring , that was broadcast on Fox for four seasons from August 29 , 2005 to May 15 , 2009 , and a fifth season which premiered on April 4 , 2017 ."
2891,"In the early 1990s , he began his career as an independent filmmaker with the release of Reservoir Dogs in 1992 ; regarded as a classic and cult hit , it was called the `` Greatest Independent Film of All Time '' by Empire ."
2892,"The film stars the voices of Jay Baruchel , Gerard Butler , Craig Ferguson , America Ferrera , Jonah Hill , T.J. Miller , Kristen Wiig , and Christopher Mintz-Plasse ."
2893,"Evans also portrayed the vampire Dracula in the character 's film origin story , Dracula Untold ."
2894,He is best known for hosting several late-night talk shows ; since 2010 he has hosted Conan on the cable channel TBS .
2895,"Moscow is the capital and most populous city of Russia , with 13.2 million residents within the city limits and 17.8 million within the urban area ."
2896,"Produced by Illumination Entertainment for Universal Pictures , it was directed by Pierre Coffin and Kyle Balda , written by Brian Lynch , and produced by Chris Meledandri and Janet Healy ."
2897,"`` Thinkin Bout You '' is a song by American singer Frank Ocean , released as the lead single from his debut studio album Channel Orange  ( 2012 )  ."
2898,Overwatch is a team-based online multiplayer first-person shooter video game developed and published by Blizzard Entertainment .
2899,It was founded in 1991 by Linda Wells .
2900,"A hate group is a social group that advocates and practices hatred , hostility , or violence towards members of a race , ethnicity , nation , religion , gender , gender identity , sexual orientation or any other designated sector of society ."
2901,"Betty Lynn Buckley  ( born July 3 , 1947 )  is an American stage , film and television actress , and singer ."
2902,"Sofia Carmina Coppola  (  [ ˈkoʊpələ ]  ; born May 14 , 1971 )  is an American screenwriter , director , producer and actress ."
2903,Gorillaz are an English virtual band created in 1998 by musician Damon Albarn and artist Jamie Hewlett .
2904,"Remote Control Productions , Inc. is a film score company run by composer Hans Zimmer and based in Santa Monica , California ."
2905,"McKinley led the nation to victory in the Spanish -- American War , raised protective tariffs to promote American industry , and maintained the nation on the gold standard in a rejection of inflationary proposals ."
2906,"Despicable Me is a 2010 American 3D computer-animated comedy film from Universal Pictures and Illumination Entertainment that was released on July 9 , 2010 in the United States ."
2907,"In 1858 , while taking part in a series of highly publicized debates with his opponent and rival , Democrat Stephen A. Douglas , Lincoln spoke out against the expansion of slavery , but lost the U.S. Senate race to Douglas ."
2908,"It was first published on August 1 , 1996 ."
2909,"Apple 's consumer software includes the macOS and iOS operating systems , the iTunes media player , the Safari web browser , and the iLife and iWork creativity and productivity suites ."
2910,"Jalāl ad-Dīn Muhammad Rūmī , also known as Jalāl ad-Dīn Muhammad Balkhī , Mevlânâ / Mawlānā  ( مولانا , `` our master '' )  , Mevlevî / Mawlawī  ( مولوی , `` my master '' )  , and more popularly simply as Rumi  ( 30 September 1207 -- 17 December 1273 )  , was a 13th-century Persian Sunni Muslim poet , jurist , Islamic scholar , theologian , and Sufi mystic ."
2911,"Since this time , Bradford has emerged as a tourist destination , becoming the first UNESCO City of Film with attractions such as the National Science and Media Museum , Bradford City Park , the Alhambra theatre and Cartwright Hall ."
2912,"After they formed under the name Pectoralz , Guy Berryman joined the group as bassist and they changed their name to Starfish ."
2913,He later played for the Calgary Stampeders in the Canadian Football League and was cut two months into the 1995 season .
2914,"Joan Crawford  ( born Lucille Fay LeSueur ; March 23 , c. 1904 -- May 10 , 1977 )  was an American film and television actress who began her career as a dancer and stage showgirl ."
2915,"It is drawn from the novel of the same name by James Ellroy and stars Josh Hartnett , Scarlett Johansson , Aaron Eckhart and Hilary Swank ."
2916,"Nikola Tesla  ( Никола Тесла 10 July 1856 -- 7 January 1943 )  was a Serbian-American inventor , electrical engineer , mechanical engineer , physicist , and futurist who is best known for his contributions to the design of the modern alternating current  ( AC )  electricity supply system ."
2917,Kumkum Bhagya  ( English : Vermillion In My Fate )  is a Hindi-language Indian soap opera which premiered on 15 April 2014 .
2918,"Belgium  (  [ ˈbɛldʒəm ]  België  [ ˈbɛlɣijə ]  ; Belgique  [ bɛlʒik ]  ; Belgien  [ ˈbɛlɡi̯ən ]  )  , officially the Kingdom of Belgium , is a sovereign state in Western Europe bordered by France , the Netherlands , Germany , Luxembourg , and the North Sea ."
2919,Tender Mercies is a 1983 American drama film directed by Bruce Beresford .
2920,"Catheters can be placed in veins in the neck  ( internal jugular vein )  , chest  ( subclavian vein or axillary vein )  , groin  ( femoral vein )  , or through veins in the arms  ( also known as a PICC line , or peripherally inserted central catheters )  ."
2921,"The Caracazo , or sacudón , is the name given to the wave of protests , riots , looting , shootings and massacres that began on 27 February 1989 in Venezuela 's capital , Caracas , and the surrounding towns ."
2922,"The season ended with the Boston Celtics winning the NBA Championship , beating the Los Angeles Lakers 4 games to 3 for the second time since 1969 in the NBA Finals ."
2923,"Dolly Rebecca Parton Dean  ( born January 19 , 1946 )  , professionally known as Dolly Parton , is an American singer , songwriter , multi-instrumentalist , record producer , actress , author , businesswoman , and philanthropist , known primarily for her work in country music ."
2924,"It is located on the southeast coast of the Persian Gulf and is the capital of the Emirate of Dubai , one of the seven emirates that make up the country ."
2925,"William Shatner  ( born March 22 , 1931 )  is a Canadian actor , author , producer , and director ."
2926,"Christopher Michael Pratt  ( born June 21 , 1979 )  is an American actor ."
2927,"Blending psychological horror with film noir , the film stars Kyle MacLachlan , Isabella Rossellini , Dennis Hopper and Laura Dern ."
2928,"John Felix Anthony Cena Jr.  (  [ ˈsiːnə ]  born April 23 , 1977 )  is an American professional wrestler , rapper , actor , and reality television show host ."
2929,"He was born in Bridgeport , Connecticut , and raised in nearby Fairfield ."
2930,"Las Vegas is an internationally renowned major resort city known primarily for its gambling , shopping , fine dining , entertainment , and nightlife ."
2931,"The song was produced by RedOne and co-written by RedOne , Gaga and Akon , while also featuring labelmate Colby O'Donis ."
2932,"Founded in 2010 by Robert James Russell and Jeff Pfaller , Midwestern Gothic publishes both fiction , essays and poetry ."
2933,Dirt  ( styled d!rt for logos )  is an American television serial broadcast on the FX network .
2934,"She then ventured into film , appearing in 50 First Dates  ( 2004 )  and A Prairie Home Companion  ( 2006 )  ."
2935,"Distributed by Summit Entertainment and Lionsgate Films , the series consists of four science fiction films set in a dystopian society ."
2936,"Kick-Ass is a 2010 British-American superhero black comedy film based on the comic book of the same name by Mark Millar and John Romita , Jr. ."
