Headline,Body ID
Jackfruit is native to parts of South Asia and is cultivated.,0
Dangerous Liaisons is based on Les liaisons dangereuses.,1
Jackie Evancho issued an EP and albums.,2
Joseph Barbera was an American producer.,3
R. Kelly wrote a song for the soundtrack of Space Jam.,4
Yusuke Murata illustrated the manga Eyeshield 21.,5
"Laura Linney was nominated for Tony Awards for The Crucible, Sight Unseen, Time Stands Still, and The Little Foxes.",6
Katie Price has had 3 marriages.,7
Cindy McCain is the wife of American John McCain.,8
Sophie Turner has been in movies.,9
The House at Pooh Corner was written by an author.,10
Fifty Shades of Grey is a novel.,11
Jesus performed an action.,12
SpaceX wants to transport astronauts to ISS and return them to Earth safely.,13
Empress Matilda married a man.,14
Berlin is influenced by a temperate seasonal climate.,15
Karl Urban played Eomer in Peter Jackson's The Lord of the Rings trilogy.,16
The Illusionist was a success critically.,17
"Splash, released in 1984, is an American fantasy comedy film.",18
Hairspray sold copies in the USA.,19
Mike Pence supported the Tea Party movement.,20
The RMS Titanic called at France.,21
Stanley Tucci is a person.,22
Vladimir Putin returned to being Prime Minister in 2008.,23
Amazon Web Services featured services for networking.,24
Seal was born in 1963.,25
Walt Disney Pictures produced a film featuring the performance of Dennis Quaid.,26
The Promise premiered in 2016.,27
Adolf Hitler caused the murder of at least 5.5 million Jews.,28
Argentinian Lionel Messi plays soccer professionally.,29
Jenni Rivera won at least one award in 2007.,30
The internet originated in a project to build communication via computer networks.,31
"The number of residents of New Orleans is 343,829.",32
Jules Dumont d'Urville was a traveler.,33
Christina Aguilera sold albums.,34
John Denver sang about Colorado numerous times.,35
Wyatt Earp served as a bouncer.,36
Nick Jonas is a recording artist.,37
"Rebecca Ferguson starred in ""Life"".",38
A seven time Formula One World Champion is Michael Shumacher.,39
That '70s Show is a sitcom.,40
Rose Kennedy was an American born in the 1800s who lived to be over 100 years old.,41
Assassination is a film that Jun Ji-hyun is in.,42
Billy Bob Thornton was in U Turn (1997).,43
Snoop Dogg has worked with Dr. Dre.,44
Maynard James Keenan started the rock supergroup A Perfect Circe in 1999.,45
Kate Nash was taken off of her record label.,46
Abigail Breslin is a woman.,47
Julia Louis-Dreyfus has won a Primetime Emmy Award.,48
Nicole Kidman performs in films.,49
Jane Eyre was released in 2011.,50
Tramadol may cause nausea.,51
Interstellar premiered in the 2010s.,52
Titanic is a work.,53
Thenmerku Paruvakaatru is a 2010 drama film.,54
Leslie Howard directed professionally.,55
Richard Gere starred in a film that is categorized as musical.,56
Kurt Angle wrestles professionally.,57
Pembroke Castle is a fortified structure.,58
Muhammad Ali was a boxer.,59
"Loving tells the story of the 1967 U.S. Supreme Court decision Loving v. Virginia, which invalidated state laws prohibiting interracial marriage.",60
Robert Browning birth month is May.,61
Cindy McCain is the wife of a man.,62
Shakira is a dancer.,63
All the Lovers reached the top ten in France.,64
A central venous catheter is also referred to as a central line.,65
Michelle Obama gave speeches at two Democratic National Conventions.,66
The Incredible Hulk is a movie about superheroes.,67
Al Gore's middle name is Arnold.,68
Zendaya is professionally known by just her first name.,69
A mixtape is a home-made compilation of music.,70
Geraldine Chaplin made her American acting debut in Doctor Zhivago.,71
Hayden Panettiere starred as Sheryl Yoast in Remember the Titans.,72
Ready Player One was passed over for an award for libertarian science fiction novels.,73
William McKinley served as a US president.,74
Moana is a North American film.,75
Michael Jackson was a dancer.,76
Syd Barrett contributed to A Saucerful of Secrets.,77
Jerry Goldsmith collaborated with Paul Verhoeven.,78
Only Lovers Left Alive is a film.,79
Stone Temple Pilots had an original member that was born in February.,80
Warm Leatherette is by a woman.,81
From the Earth to the Moon is a miniseries.,82
The Uruguay national football team won the 1980 Mundialito.,83
Willie Nelson is a writers of songs.,84
John Cusack is an actor.,85
Neal Schon is an American vocalist.,86
Investment funds are also referred to as collective investment schemes.,87
The fifth president of Iraq was Saddam Hussein.,88
Avatar: The Last Airbender is a television series that is animated.,89
Slash writes songs.,90
Paul Feig was the director of a comedy film that had two women writers.,91
Amazon Web Services included tools for the inter-networking of physical technology.,92
David Beckham won the Premier League title multiple times.,93
Watchmen is a DC Comics collection.,94
One by One (Foo Fighters album) is the fourth studio album of Foo Fighters.,95
Rock music originated in North America.,96
Antonio Vivaldi was born in a city in Italy.,97
Roman Atwood was born in 1983.,98
A producer of Spider-Man 3 was an Israeli-American businessman.,99
Sean Connery won an Academy Award.,100
Blue Velvet was written by David Lynch.,101
The 20th President of Liberia was William R. Tolbert Jr..,102
Odin was known in Old Saxon mythology as Wōdan.,103
Logan Lerman starred in a 2016 American drama work.,104
Dwyane Wade was in the All-Star team.,105
George VI was succeeded by his eldest female child.,106
Jon Watts had the movie Spider-Man: Homecoming released in 2017.,107
Ted Kaczynski conveyed a letter to the New York Times.,108
Gone Girl was written by Gillian Flynn.,109
Sigmund Freud set up his clinical practice in Vienna and was influential.,110
Wonder Woman has appeared in the comics for the Justice Society.,111
Yusuke Murata illustrated the manga Eyeshield 21.,112
Jensen Ackles is not known for his roles in television as Jason Teague in Smallville.,113
"Hate group practices hatred, hostility, or violence towards members of a race, ethnicity, nation, religion, gender, gender identity, sexual orientation or any other designated sector of society.",114
Aishwarya Rai was in several television commercials.,115
Donkey can be characterized as a fast talker.,116
The USC School of Cinematic Arts was formerly called the USC School of Cinema-Television.,117
Julie Christie starred in a movie.,118
Robert Redford was in the main cast of Perry Mason.,119
Unforgettable is directed by debut director Denise Di Novi.,120
Furia is adapted from a short story by Julio Cortazar.,121
"Lady Gaga is an American singer, songwriter, and actress.",122
Stone Temple Pilots had an original member that was an American rock guitarist.,123
The French Revolution happened after the Seven Years' War in 1789.,124
Jane Fonda is a seven-time Academy Award nominee.,125
King Kong was directed by a person.,126
Winnipeg is home to the Winnipeg Goldeyes.,127
"Giampaolo Pazzini represented his country, Italy, at the 2010 FIFA World Cup.",128
Steve Buscemi is in at least one movie.,129
Dennis Hopper had an acting career.,130
A Few Good Men is a film.,131
Naomi Watts is an English film producer.,132
Zendaya released a single.,133
England shares land borders with Scotland and Wales.,134
Dwyane Wade was in the All-Star team.,135
"The Hangover Part III includes Bradley Cooper, Ed Helms, Zach Galifianakis, Justin Bartha, and Ken Jeong, Jeffrey Tambor, Heather Graham, Mike Epps, Melissa McCarthy and John Goodman.",136
Usher has a sophomore album.,137
Davis Guggenheim is a television director.,138
Maggie Gyllenhaal played a role.,139
Silicon Valley is a place.,140
Elle Fanning starred in the sci-fi movie Super 8.,141
Facebook's CEO is Mark Zuckerberg.,142
"Los Angeles, California was incorporated as a municipality on April 4, 1850.",143
Eric Singer has performed with a musician.,144
The United States Naval Academy is a service academy.,145
Lewis Hamilton was the runner-up to teammate Nico Rosberg in 2016.,146
Tim Henman rose up the ATP rankings.,147
Paradigms of Human Memory was written by Chris Mckenna.,148
Kate & Leopold is a film.,149
Akira Toriyama created Dragon Ball.,150
The Twilight Saga stars multiple people.,151
Boardwalk Empire is a drama.,152
Hugh Hefner is an American men's lifestyle magazine publisher.,153
Estella Warren is a synchronized swimmer formerly.,154
George Lucas was the founder of a motion picture visual effects company.,155
Minneapolis lies on both banks of the Mississippi River in Minnesota.,156
The X Factor is a music competition.,157
Seal was born in 1963.,158
Iggy Azalea signed a recording contract with Grand Hustle Records.,159
Glamorous is a song by Fergie.,160
Evan Goldberg is a Canadian film producer.,161
Arjun Kapoor hosted the IIFA Awards in Britain.,162
Drama school offers Master of Fine Arts.,163
Richard Dreyfuss has won a Golden Globe Award.,164
Jimmy Wales is an American.,165
Jim Parsons portrays Sheldon Cooper.,166
"The Olympic Games includes both a summer and winter games, each every 4 years.",167
William Hanna was an artist.,168
"Rolling Stone magazine labeled Led Zeppelin as ""the biggest band of the Seventies.""",169
Serena Williams has won four Olympic gold medals.,170
Gwen Stefani is the co-founder of No Doubt along with others.,171
"Princess Margaret, Countess of Snowdon is part of the royal family of Britain.",172
The United States meets the North Atlantic Ocean.,173
Kristofer Hivju was born in 1978.,174
Jennifer Hudson was in a singing competition.,175
The Punisher is also named Frank Castle.,176
Matthew McConaughey was in the film Texas Chainsaw Massacre: The Next Generation.,177
Gianluigi Buffon won the UEFA Club Footballer of the Year for the second time in June of 2003.,178
"Vince Vaughn appeared in a number of films in the 1990s, including the sports film Rudy.",179
An actor was the winner of a BAFTA Award for Crash.,180
Wonder Woman is a character.,181
A Song of Ice and Fire is by someone who works in the fantasy genre and he is American.,182
Alan Rickman was born in 1946.,183
Ryan O'Neal was born in the 1940s.,184
Outkast is composed of two people.,185
Bruce Willis is a person.,186
The Challenge had originally been called Road Rules: All Stars.,187
The Twilight Saga stars multiple people.,188
Furious 7 was filmed in more than one country.,189
Jeff Bezos founded something.,190
Calling All the Monsters was found through an American record label.,191
Laurence Olivier played in Romeo and Juliet.,192
Bernard Madoff was sentenced in June of 2009.,193
Evolution is a studio album.,194
Remote Control Productions has provided the scores for movies.,195
Dan Martin is Irish.,196
Keith Urban was born in a country.,197
"In the California primaries, Robert F. Kennedy beat Senator Eugene McCarthy.",198
Lisa Kudrow starred in a series.,199
Oz the Great and Powerful premiered at the fully restored movie palace at 6838 Hollywood Boulevard in Hollywood.,200
Event management is the application of project management to the development of large scale events.,201
Beauty Shop stars a human.,202
University of Oxford is made up of a variety of colleges.,203
More than 2000 runs have been scored by Alex Rodriguez.,204
Naruto: Shippuden is a sequel to Naruto.,205
The Xbox One uses an input device called the Kinect.,206
Thirteen is based on Nikki Reed's difficult life at age 12 and 13.,207
Robert Redford was a guest star on the anthology horror series Twilight Zone.,208
Macaulay Culkin acted in The Good Son.,209
Joan Cusack worked with Wilford Brimley and she is American.,210
The Fall (Gorillaz album) features Mick Jones.,211
Connaught Tunnel is in British Columbia.,212
"WWI was fought from the 28th of July, 1914 to the 11th of November, 1918.",213
Smoking is correlated with the occurrence of leukemia.,214
Thor: The Dark World is a movie from America.,215
Easy Virtue is an adaptation.,216
North Korea has a political party.,217
Whiskey Tango Foxtrot is based on The Taliban Shuffle: Strange Days in Afghanistan and Pakistan.,218
Alex Rodriguez received criticism from the media.,219
Flash Thompson bullies his classmate Peter Parker in the Spider-man comics.,220
Carter Jenkins stars in Famous in Love.,221
Buzz Aldrin is an engineer.,222
Count Basie took his orchestra to Chicago for a long engagement.,223
Paul Mantee has worked with movie director Byron Haskin.,224
Ready Player One won a prize from a nonprofit organization.,225
Horseshoe Falls is also known as something else.,226
Modern liberalism in the United States strongly endorses stuff.,227
Muhammad was raised under the care of his uncle.,228
Stephen Rider is an American actor.,229
Dawn of the Planet of the Apes is a sequel to Rise of the Planet of the Apes.,230
The Celtic F.C. is based out of Glasgow.,231
Alicia Vikander appeared in The Fifth Estate.,232
G-Dragon is an artist.,233
Portal 2 is the sequel to Portal.,234
Seal is an English songwriter.,235
Richard Gere starred in a film that is categorized as musical.,236
Rajesh Khanna earned the most money as an actor from 1970 to 1987.,237
Ji Chang-wook began life in 1987.,238
Born This Way discusses self-empowerment.,239
Gerald Ford was the President of the United States.,240
Charles Marie de La Condamine was a geographer.,241
Keanu Reeves played Johnny Mnemonic in Johnny Mnemonic.,242
The Nashville Songwriters Association International is shortened to NSAI.,243
Poland has more visits each year than all but 15 other countries in the world.,244
True Blood is set in Bon Temps.,245
Zambia is bordered by the Democratic Republic of the Congo.,246
The Fosters is a television show.,247
One city in Benin is Cotonou.,248
Nicki Minaj is Trinidadian-American singer.,249
World War II had campaigns occurring in Asia.,250
Robin appeared in DC comic books.,251
Alpha Centauri is a star system.,252
Lee Min-ho was the lead role in Gangnam Blues.,253
Seal is a songwriter from England.,254
Lucas starred a Canadian actor.,255
"Ice Hockey is popular in Canada, Finland, Latvia, the Czech Republic, Sweden, Slovakia, Belarus and Switzerland.",256
Kalpana Raghavendar is Indian.,257
A book by Larry Buttrose was the basis of Lion.,258
Tim Burton directed Miss Peregrine's Home for Peculiar Children.,259
Wyatt Earp was a saloon-keeper.,260
Sue Sylvester is portrayed by an actress.,261
Las Vegas is a county seat.,262
Doctor Zhivago's protagonist is a physician and poet.,263
Anton Yelchin performed in the late 1990s.,264
The Black Dahlia is a film.,265
Cry Freedom was shot in Kenya and Zimbabwe.,266
Warm Leatherette is by a woman.,267
Scars to Your Beautiful is by a woman.,268
The Incredible Hulk is a movie about superheroes.,269
Tunisia was occupied for one thousand days.,270
Pirates of the Caribbean had multiple directors.,271
Cleopatra represented herself as the reincarnation of a goddess.,272
J. K. Rowling had a child.,273
Julie Christie starred in a movie.,274
My Bloody Valentine 3D was edited by a human.,275
Sabrina Carpenter performs music.,276
The Republic of Zambia is bordered to the east by Malawi.,277
Fear of social situations characterizes social anxiety disorder.,278
Rick and Morty was created by Justin Roiland and Dan Harmon for Adult Swim.,279
Joss Whedon wrote The Avengers.,280
Atomic Blonde is based on The Coldest City.,281
Limbu language is spoken by people.,282
Edward is Colin Quinn's middle name.,283
Lady Gaga wrote songs as an occupation.,284
Minions was written by Brian Lynch and directed by Pierre Coffin and Kyle Balda.,285
Snoop Dogg has starred in motion pictures.,286
Phil Mickelson won the 142nd Open Championship which was played in Scotland.,287
An anti-nuclear antibodies subtype is anti-dsDNA antibodies.,288
Taylor Sheridan is a screenwriter.,289
The Land Before Time's director was Don Bluth.,290
Amy Poehler was a participant of a comedic group.,291
Neil Patrick Harris was in a Broadway musical in 2014.,292
R. Madhavan was in the cast of a movie.,293
Dungeons & Dragons was designed by Gary Gygax and Dave Arneson.,294
The Titanic's wreck is gradually disintegrating in a museum.,295
Romelu Lukaku is an athlete.,296
Star Search was relaunched in 2003-04.,297
Lisa Kudrow appeared on Showtime.,298
The English language is influenced by Germanic languages.,299
Paul Walker was an American man.,300
"The Meyerowitz stories stars Adam Sandler, Ben Stiller, Emma Thompson, and Dustin Hoffman.",301
Transformers: The Last Knight features a performance by an actor.,302
Iran is the 18th-largest city in the world.,303
Snowden is a biographical film.,304
The cell is the basic biological and functional unit of all living organisms.,305
Rose Kennedy was an American born in the 1800s who lived to be over 100 years old.,306
Mary-Louise Parker acted in Angels in America.,307
Quinoa is in the amaranth family.,308
Hungary is bordered by a country.,309
The ninth-largest economy by purchasing power parity is the United Kingdom.,310
Farrah Fawcett acted in Sunburn.,311
The Offspring released Smash after 1990.,312
Following is a neo-noir drama film.,313
Matthew Modine played a character on Stranger Things.,314
Tom Morello developed an interest in politics.,315
The Germanic peoples are also called Teutonic.,316
George Washington served as the first president.,317
Michelle Rodriguez acted in Lost.,318
Wi-Fi Certified is a term restricted by the Wi-Fi Alliance.,319
The Fall (Gorillaz album) features an English artist Paul Simonon.,320
Ray Milland worked with a studio.,321
Jensen Ackles is not known for his roles in television as Jason Teague in Smallville.,322
Leslie Groves was the director of the Manhattan Project.,323
The United Kingdom has the world's ninth-largest economy by one measure.,324
The Eagles are a group.,325
STS-96 launched from a Space Center.,326
Glee was nominated for an award.,327
Tim Allen was featured in Last Man Standing.,328
Robert J. O'Neill is a sailor formerly.,329
Moana is a work.,330
Dwayne Johnson works a part-time contract for WWE.,331
A Golden Globe was given to Jason Bateman.,332
"Tim Robbins was born on October 16, 1958.",333
Major League Soccer playoffs involves 12 teams competing against each other.,334
Unpredictable featured an artist.,335
FC Barcelona has won twenty European and World titles.,336
Sharon Tate married in January 1968.,337
Music includes avant-garde styles and has a long history.,338
Rabat is Morocco's capital city.,339
John McCain is an American citizen.,340
Bentley markets cars.,341
David Beckham played with United.,342
Michael Douglas and James Bridges have worked together.,343
Emily Blunt played a supporting role in The Devil Wears Prada.,344
Judd Apatow produced Talladega Nights: The Ballad of Ricky Bobby.,345
Hunter S. Thompson was a journalist.,346
Jack Black is an American actor that was involved with voice acting for Kung Fu Panda 3.,347
Jamie Foxx's time-point of birth is in the 20th century.,348
A film starring Oliver Reed and Vanessa Redgrave was directed by Ken Russell.,349
Paul Bettany is married to a film actress.,350
Jackie Evancho is someone who has acted in a film during 2013.,351
Samoa Joe is part of WWE.,352
Daniel Craig attended a liberal arts school.,353
The Amazing Spider-Man 2 has favorable music soundtracks.,354
Eugenio Canfari was born in the 19th century.,355
The Bends is a rock album.,356
MS Dhoni is a cricket player.,357
Captain America: The Winter Soldier was influenced by fiction.,358
Indiana Jones has been portrayed by Sean Patrick Flanery.,359
Warren Casey is a composer of Grease.,360
The Night Of's screenwriter is also an American novelist.,361
Suits (TV series) features a female actress.,362
"Tesla, Inc. has a subordinate company that has headquarters in California.",363
Frank Ocean released albums.,364
Nearly 40 million units were sold by Amaze Entertainment.,365
Andorra borders only land.,366
The reigning monarch of the UK lives in Buckingham Palace.,367
Cleopatra represented herself as the reincarnation of a goddess.,368
Jared Kushner is an owner of a newspaper.,369
Mirka Federer was also known as another name.,370
19 Kids and Counting had other names.,371
Tanzania is a place.,372
Byron Haskin was someone Paul Mantee has worked with.,373
Dumb and Dumber stars an award-winning actor.,374
Pompeii is not a UNESCO World Heritage Site.,375
Black Sabbath was formed by 4 people.,376
Rescue Me is a comedy TV series.,377
Chris Hemsworth is an actor.,378
One Direction has won awards.,379
J. J. Cale was born in 1938.,380
Haitian Creole is a linguistic structure spoken by 9.6 to 12 million humans.,381
Thank Me Later is the name of a Drake album.,382
The Void was first shown at the 2016 Fantastic Fest.,383
"Arya Stark is a female, fictional character in the A Song of Ice and Fire series of fantasy novels",384
R. Madhavan was in the cast of Guru.,385
NASA has followed most US space exploration efforts.,386
The alternative history novel The Man in the High Castle won the Hugo Award for best novel.,387
Measles develop almost 2 weeks after exposure to an infected person.,388
Nicki Minaj has been nominated for 10 Grammys.,389
Devdas won awards.,390
Bohemian Rhapsody is a song.,391
Boston Legal stars James Spader as a lawyer.,392
Tim Henman rose up the ATP rankings.,393
Keeping Up with the Joneses had a budget.,394
Troy Baker's indie band released an album.,395
Gerard Lee is from Earth.,396
Equidae is sometimes known by another name.,397
Kurt Sutter is the creator of Sons of Anarchy.,398
Indian was produced by A. M. Rathnam.,399
Nicki Minaj is Trinidadian-American singer.,400
Jake Gyllenhaal is a person.,401
The Dakota is an apartment building in the US.,402
Susan Atkins was a California inmate.,403
Toronto's area is 630.2 square kilometers.,404
The Smurfs began filming in the 2010s.,405
Denzel Washington was in Glory.,406
Jerome is recognized by the Roman Catholic Church.,407
Adam Sandler voice acted in Hotel Transylvania 2.,408
"Estella Warren date of birth is  December 23, 1978.",409
"Mickey Rooney played a supporting role in It's a Mad, Mad, Mad, Mad World (1963).",410
A Few Good Men is a film.,411
Adrianne Palicki turned down a supporting role in John Wick.,412
"Avengers: Age of Ultron premiered in LA on April 13, 2015.",413
Seville is a place that is larger than a town.,414
Mel Brooks has three of his films ranked on the list for the American Film Institute .,415
Captain America is a graphic novel.,416
"Ubisoft, French company, was formerly known as Ubi Soft Entertainment Software.",417
Paul Simon is an actor.,418
Entertainment takes place in Las Vegas.,419
Pablo Picasso was a artist in 1906.,420
Dangerous Liaisons is a film.,421
Farrah Fawcett was in Sunburn.,422
Unleashed features Bob Hoskins.,423
Beyond Westworld was a work.,424
The 1983-84 NBA season ended with the Los Angeles Lakers losing.,425
Joseph Fiennes has worked in tv acting.,426
Before Night Falls is a biographical film.,427
Britney Spears starred in Crossroads.,428
Florence Ballard struggled with alcoholism.,429
The Walt Disney Company owns ESPN.,430
"De Profundis was inscribed to ""Bosie.""",431
Elizabeth Taylor was a person.,432
"Sylvester Stallone was born on July 6, 1946.",433
Anne Frank was a person.,434
Wild has an actor.,435
Snowpiercer is co-written by a New Yorker.,436
Back to the Future Part II is a comedy.,437
Measles complications occur in about 30% of people,438
Emily Ratajkowski is a model.,439
Jean-Claude Van Damme is a Belgian film producer.,440
Winnie Harlow's birth year is 1994.,441
Pablo Fenjves ghostwrote words.,442
Emily Ratajkowski is a model.,443
Tony Bill shared an award with Michael Phillips and Julia Phillips.,444
Kurt Angle is a winner of the WWE Championship.,445
Serbia has a high rank on the Global Peace Index.,446
Enemy (2013 film) stars Sarah Gadon.,447
Transformers: The Last Knight features a performance by an actor.,448
Steve Jobs was a businessman.,449
A capital was where the Caracazo took place.,450
Justin Bieber's fourth album came out in 2015.,451
Joey Graceffa is American.,452
Leroy Jethro Gibbs is a fictional character on NCIS.,453
Minecraft is a work.,454
Emily Browning is in The Host.,455
Stephen Hawking suffers from motor neurone disease,456
FX television channel premiered Damages (TV series).,457
Floyd Mayweather Jr. is a person.,458
Alpha House is inspired by a politician.,459
"The number of residents of New Orleans is 343,829.",460
Carice van Houten is a person.,461
Francis Ford Coppola is an American.,462
Portal 2 is the sequel to Portal.,463
Machu Picchu is a 15th-century Inca citadel.,464
Connie Britton played a role in a horror anthology television series.,465
Farrah Fawcett took an Emmy Award nomination for her role as a battered wife in the 1984 film The Burning Bed.,466
"For five years, Jennifer Aniston was in a marriage with Brad Pitt.",467
Jim Carrey is a person.,468
Edgar Award honors the best in non-fiction.,469
Gustave Eiffel focused on meteorology research.,470
Kirk Douglas is an acting professional in the film industry.,471
Psychological horror is a subgenre of horror and psychological fiction.,472
Frederick Trump was born in a state.,473
Sofia Coppola acted in a drama film based on a novel.,474
"The second season of the American television show Sonny with a Chance premiered on March 14th, 2010.",475
Miami Blues featured Jennifer Jason Leigh.,476
Glacier can be found in Hawaii.,477
"Jane Fonda acted in They Shoot Horses, Don't They.",478
Soundgarden signed to a major label.,479
The Beach Boys had over eighty worldwide chart songs.,480
The Punisher is also named Frank Castle.,481
Fred Trump engaged in philanthropy.,482
Lahore is the place where one can find the Shalimar Gardens.,483
Steve Buscemi is in at least one movie.,484
Whiskey Tango Foxtrot is a comedy film.,485
"The Jacksons ended on March 9, 1977.",486
Avatar: The Last Airbender is a television series that is animated.,487
"Kolyma has rich reserves of gold, silver, tin, tungsten, mercury, copper, antimony, coal, oil, and peat.",488
