Headline,Body ID
Batman Begins is considered one of the best superhero films.,2427
Underworld is a movie.,2428
Soundgarden was a band.,2429
Christian Bale acted in multiple Batman films.,2430
Alexandra Burke is British.,2431
The Democratic Republic of the Congo is a former Belgian colony.,2432
Quentin Tarantino made the movie Reservoir Dogs.,2433
Octopuses expel ink into the water as an escape mechanism.,2434
Sportsman of the Year has been awarded to Michael Schumacher.,2435
"George Best has been labelled as ""the greatest player to ever pull on the green shirt of Northern Ireland.""",2436
Cara Delevingne portrayed Margo Roth Spiegelman in Paper Towns (2015).,2437
Splash starred Tom Hanks and John Candy.,2438
Kobe Bryant was awarded the regular season's MVP Award in the 21st century.,2439
Lauren Graham received one Golden Globe nomination.,2440
Man of Steel (film) was directed by Zack Snyder.,2441
The Portuguese Empire is also referred to as The Portuguese Overseas.,2442
One series is Boardwalk Empire.,2443
None of lung cancer's symptoms is chest pains.,2444
Ayn Rand supported capitalism.,2445
Google has received significant criticism for censorship issues.,2446
Texas was once ruled by another country.,2447
One producer is Lupe Fiasco.,2448
"Adele is from London, England.",2449
Radiohead has used pay-what-you-want.,2450
Tessanne Chin is best known for winning The Voice.,2451
"Lady Gaga is an American singer, songwriter, and actress.",2452
The Hellenic goddess of wild animals was called Artemis.,2453
Russell Brand is an English comedian.,2454
Clarice Starling is a The Silence of the Lambs character.,2455
Star Trek (film series) have received 15 award nominations.,2456
The United States has over 324 million people.,2457
Stanley Kubrick directed a movie that starred Jack Nicholson.,2458
Underworld stars an actress.,2459
Dirt (TV Series) is a program.,2460
Short Term 12 is a film categorized as a drama.,2461
"Providence, Rhode Island was founded by a religious outcast.",2462
Tina Turner released at least nine solo albums.,2463
Romelu Lukaku won a championship.,2464
Mother Teresa received a prize.,2465
Paulo Dybala is a person from Argentina.,2466
Texas was once ruled by another country.,2467
Davis Entertainment's divisions develop and produce television projects.,2468
Sue Sylvester is portrayed by an actress.,2469
Fifth Harmony has members.,2470
Several models starred in The Twilight Saga.,2471
Ted Bundy committed murders.,2472
George Washington was a politician.,2473
George VI was succeeded by his eldest female child.,2474
The South Wales Valleys are in Wales.,2475
The United States Naval Academy is mixed-sex.,2476
Breaking Bad's crew include Bob Odenkirk.,2477
Twelve actors have played the Doctor.,2478
Francis Ford Coppola is a screenwriter.,2479
The Wicked Witch of the West was created by the author L. Frank Baum.,2480
Metallica made the album Hardwired... to Self-Destruct.,2481
Jackie Robinson was awarded the Presidential Medal of Freedom.,2482
Belgium is 41% French-speaking.,2483
Galaxy Quest is a work.,2484
Jackie Robinson's uniform number was in the forties.,2485
Dumb and Dumber stars an award-winning actor.,2486
A planet is Venus.,2487
Tori Kelly is a vocalist.,2488
William McKinley was a person involved in professional politics.,2489
See You Again (Miley Cyrus song) was remixed by an American record team.,2490
Nocturnal Animals is a film.,2491
Led Zeppelin II is a rock album.,2492
Courtney Love is an actor.,2493
Brentwood is located in a country.,2494
Dogstar (band) performed at the Glastonbury Festival.,2495
Azerbaijan is part of the Muslim world.,2496
"In 2011, the Writers Guild of America gave Steven Zaillian an award.",2497
Transformers (film) is a science fiction film.,2498
Miley Cyrus cultivated a type of image.,2499
Anne Hathaway won an award.,2500
The American television show called Sonny with a Chance was on Disney Channel.,2501
Paul Bettany is married to a film actress.,2502
The Breakfast Club is a film.,2503
One producer is Lupe Fiasco.,2504
Frank Sinatra toured the United States.,2505
Andy Warhol is creative.,2506
An Academy Award nominee for Best Visual Effects was Captain America: The Winter Soldier.,2507
Frank Sinatra has been the winner of an Academy Award.,2508
The Murder of Roger Ackroyd is a work.,2509
Live Your Life is by an American.,2510
Tropic Thunder was written by a person.,2511
The New York Times is declining.,2512
Mr. Freeze is an enemy of Batman.,2513
Mark Ruffalo is an American film producer.,2514
Tommy Chong has Canadian and American citizenship.,2515
The internet is the global system of interconnected computer networks.,2516
DJ Khaled assisted in the hip-hop albums.,2517
Courteney Cox played Monica Geller on Friends.,2518
John Lennon was English from Liverpool.,2519
Heather Graham starred in films.,2520
A novel is the basis for which the story for War of the Worlds was written.,2521
Slovakia joined the Eurozone in 2009.,2522
Nepal is a South Asian country.,2523
"Saskatchewan had an estimated population of 1,114,170 in December of 2013.",2524
Caroline Blakiston stars in a Star Wars movie.,2525
Sherlock's first series became the UK's most watched drama series since 2001.,2526
Abraham Lincoln promoted rapid modernization of the economy.,2527
Paris Hilton is an American citizen.,2528
Amy Poehler was a participant of a comedic group.,2529
Chris Hardwick is a comedian.,2530
Meryl Streep is an actress.,2531
Avril Lavigne is a North American.,2532
Lipstick Under My Burkha has audio pornography as well as sexual scenes.,2533
Emmy Rossum had a prominent role in An American Rhapsody (2001).,2534
Rafael Nadal is from Europe.,2535
Edward VIII's term began in 1936.,2536
Christopher Columbus encountered Central America.,2537
Marie Antoinette is a parent.,2538
Renaissance art involved Florence.,2539
Winona Ryder was a cast member of a movie.,2540
The Nintendo Switch is a video game console that uses Joy-Con wireless controllers.,2541
The United States was included in the 19th G7 summit.,2542
Daniel Craig went to school in London.,2543
Rick and Morty's creators are Justin Roiland and Dan Harmon.,2544
Bulgaria was in both world wars.,2545
Steven Soderbergh won an award.,2546
Paris Hilton is an American citizen.,2547
Buddy Holly's style was influenced by gospel music.,2548
Purple Haze was released in 1967.,2549
Red is a film that was released in 2010.,2550
Tiger Woods won The Silver Medal at The Open Championship.,2551
Formula One holds racing events all over the world.,2552
Albania is a part of the Organisation of Islamic Cooperation.,2553
MS Dhoni is a cricket player.,2554
The Catalyst is by American rock band Linkin Park.,2555
Triple H is a professional wrestler from America.,2556
William Jennings Bryan served at least one term as a member of the United States House of Representatives.,2557
Dhool is an action film.,2558
Arrested Development follows the fictitious Bluth family.,2559
The Eagles released their third album in 1974.,2560
A major film studio is Fox.,2561
Odin is from Norse Mythology.,2562
None of lung cancer's symptoms is chest pains.,2563
"Minneapolis was at one time, the world's flour milling capital.",2564
David Beckham won the Premier League title.,2565
The Academy Awards are overseen by AMPAS.,2566
Just Dance was premiered in 2008.,2567
The Black Dahlia is a film.,2568
Colin Quinn's middle name is Edward.,2569
Janeane Garofalo is included in Duane Hopwood.,2570
Oliver Reed was born in a month in 1938.,2571
The Last House on the Left is a motion picture.,2572
Joan of Arc became a symbol of the Catholic League in the 16th century.,2573
The Man in the High Castle takes place in 1962.,2574
The Big Trail stars John Wayne.,2575
Janeane Garofalo is included in Duane Hopwood.,2576
Logic has a gold record.,2577
Cate Blanchett is an actress.,2578
Philip V of Spain was a member of a European royal house.,2579
Murder on the Orient Express starred an actress.,2580
John Lennon was from England.,2581
War Dogs stars an actor.,2582
Ellen Burstyn was nominated for five Emmy Awards and seven Golden Globes.,2583
Erich von Manstein was released prematurely from a 12 year prison sentence in 1953.,2584
Kurt Angle has twice won the King of the Mountain match.,2585
Jorah Mormont is portrayed by a Scottish stage actor.,2586
Jorah Mormont is portrayed by a Scottish stage actor.,2587
Black Mirror is a British television show.,2588
Ad-Rock is married to Kathleen Hanna.,2589
Abraham Lincoln spoke out against something.,2590
Dhoom 3 signifies Blast 3 in English.,2591
Robert Duvall starred in numerous shows.,2592
James Blake (musician) released his third film The Colour in Anything in 2016.,2593
Russell Brand is an English comedian.,2594
Joy is a film.,2595
Thank Me Later is the name of a Drake album.,2596
Above the Law was released in 1988.,2597
New York contains Niagara Falls in the north.,2598
Billy Clanton has stolen something.,2599
Filmfare is a magazine the size of a tabloid.,2600
Borrelia afzelli is part of the spirochete phylum.,2601
Joaquin Phoenix played a supporting role in Quills.,2602
University of Oxford is in the world.,2603
Adam Driver was in a film.,2604
Ballet Shoes was published in the 20th century.,2605
George W. Bush's brother is Jeb Bush.,2606
Cracks's had its theatrical release in UK and Ireland.,2607
Nice & Slow appears on an album.,2608
The exact function of Huntington's disease is unknown.,2609
"Andre Agassi won all four Grand Slam tournaments on hard, clay, and grass surfaces.",2610
Interpersonal psychotherapy is heavily based on regular personal interaction.,2611
Kris Wu starred in several #1 box office hits.,2612
"Tyler, The Creator was born in March.",2613
Gang Signs & Prayer is an album by a recording artist in the grime music genre.,2614
Rabat is a capital city.,2615
R. Madhavan produced a film.,2616
Vladimir Putin returned to being Prime Minister in 2008.,2617
Guitar is an instrument played by Slash.,2618
Mother Teresa lived in Macedonia for eighteen years.,2619
An actor won an Academy Award for Crash.,2620
Lexmark is a Chinese-owned corporation based in America.,2621
Cheyenne Jackson was in a 2006 biographical drama-thriller movie.,2622
Robert Browning wrote poetry.,2623
Venus and Earth have a similar proximity to the Sun.,2624
Mel Brooks has three of his films ranked on the list for the American Film Institute .,2625
Adam West was born in a month.,2626
"George H. W. Bush was an American Republican politician born June 12, 1924.",2627
Haitian Creole is a linguistic structure spoken by 9.6 to 12 million humans.,2628
Aishwarya Rai has one female child.,2629
Life Is Peachy is an album in the nu metal genre.,2630
River Pheonix is involved in films.,2631
Ben Kingsley's work has extended over 40 years.,2632
Babe Ruth was a professional Major League baseball player.,2633
Abigail Breslin is a woman.,2634
Drama school offers a degree.,2635
Twitter had more than 100 million users in winter of 2012.,2636
Dominick Dunne was a journalist.,2637
Try was recorded by an artist.,2638
To Kill a Mockingbird has themes of racial injustice and destruction of innocence.,2639
"For his work on 30 Rock, Alec Baldwin won two Emmy Awards.",2640
The Martian is a 2015 big science fiction film.,2641
John Nash built the Brighton.,2642
"Laura Linney was nominated for Tony Awards for The Crucible, Sight Unseen, Time Stands Still, and The Little Foxes.",2643
Napoleon commanded his first military campaign at age 26.,2644
Colin Quinn is an American stand-up comedian.,2645
Keanu Reeves was the prince in a production of Hamlet.,2646
Robert Lee Yates killed thirteen women.,2647
A capital was where the Caracazo took place.,2648
Tom Cruise was in a science fiction psychological thriller film.,2649
Water occurs in nature.,2650
Charlie Chaplin had a parent.,2651
Sarcoidosis is a disease.,2652
Keanu Reeves was the prince in a production of Hamlet.,2653
Jimmy Carter led the international boycott of the 1980 Moscow Olympics.,2654
Bali is north of Australia.,2655
Steve Coogan starred as Paul Raymond in The Look of Love.,2656
The Los Angeles Lakers won more than 30 consecutive games.,2657
How to Be is a film.,2658
Papua New Guinea has land in Melanesia.,2659
Live Your Life was released in Britain.,2660
Kate & Leopold is a film.,2661
Muhammad Ali was an athlete.,2662
Eleveneleven is a company.,2663
Bruce Willis is an American actor.,2664
"In the 1960's, George Tuska worked on Iron Man comics.",2665
FC Barcelona's leader was Joan Gamper.,2666
Planet of the Apes was based on Pierre Boulle's 1963 science fiction novel of the same name.,2667
Octopuses expel ink into the water as an escape mechanism.,2668
The Chainsmokers released the number-one song Closer.,2669
Lust for Life is a film.,2670
Arnold Schwarzenegger's breakthrough film as an actor was released in 1982.,2671
Limbu language is spoken by people.,2672
Samuel Witwer is from the Western Hemisphere.,2673
Robert Duvall won the National Medal of Arts in 2005.,2674
La La Anthony played a character named Sonia in a work directed by Tim Story.,2675
Havoc is a film.,2676
Tony Blair was elected after a politician's sudden death.,2677
Journey was once named the fifth-best American rock band by USA Today.,2678
Naproxen relieves ailments.,2679
Texas has piney woods.,2680
Ryan O'Neal was born in the 1940s.,2681
Up All Night was released by a record label.,2682
Indian was chosen the Best Foreign Language Film in 1996.,2683
Judy Garland was awarded a Grammy Lifetime Achievement Award.,2684
Woody Harrelson was featured in Friends with Benefits.,2685
Christopher Marlowe is a person.,2686
Lady Gaga is known for her provocative work.,2687
Supernatural is a fantasy series.,2688
Yelp expanded throughout at least one continent.,2689
Marie Curie was trained in science.,2690
My Bloody Valentine 3D features Jensen Ackles in a lead role.,2691
Joy is a film.,2692
Sarah Palin was a governor.,2693
Tipper Gore was born in August 1948.,2694
Jennifer Grey was born in the U.S.,2695
Brad Bird pitched The Incredibles.,2696
Tamera Mowry portrayed a character.,2697
Believe is an album.,2698
Saint Peter was ordained by Jesus according to Catholic teaching.,2699
Whoopi Goldberg co-produced a show.,2700
Ad-Rock is married to Kathleen Hanna.,2701
Saw VI is a movie in the Saw franchise.,2702
Ludacris has won a Critic's Choice award.,2703
Born This Way discusses self-empowerment.,2704
Queen Victoria's son belonged to a house.,2705
7 Things is a song by actress and singer Miley Cyrus.,2706
Jerry Seinfeld is a director.,2707
The Hunger Games is set in a dystopian society.,2708
Thomas Pynchon wrote the novel V.,2709
"Destiny was released on September 9, 2014.",2710
Caitlyn Jenner changed her gender.,2711
Coldplay is a group.,2712
My Bloody Valentine 3D stars an American actor born in 1972.,2713
Game of Thrones (season 3) takes place in Westeros.,2714
Colin Powell was the 65th US Secretary of State.,2715
A producer of Spider-Man 3 was an Israeli-American businessman.,2716
Venus Williams is one of the best female tennis players.,2717
Furia is written by a filmmaker.,2718
Lady Gaga wrote songs as an occupation.,2719
Caroline Blakiston stars in a Star Wars movie.,2720
John Constantine got his own comic in 1988.,2721
Pan Am premiered on an American television network known as ABC.,2722
Tom Felton has an acting career.,2723
Felicity Huffman is an actress on stage.,2724
Led Zeppelin II was released by Atlantic Records in 1969.,2725
Peyton Manning played football.,2726
Lee Harvey Oswald shot Kennedy.,2727
Splash was written by two people.,2728
The Void was first shown at the 2016 Fantastic Fest.,2729
Lamniformes include some of the most familiar species of sharks.,2730
Dogstar (band) released two albums.,2731
Land Rover makes the Defender.,2732
Joey Graceffa is American.,2733
Connaught Tunnel replaced a previous routing.,2734
Baloo was featured in The Second Jungle Book.,2735
Robbie Collin studied a branch of philosophy.,2736
Michael McCullers worked with Americans.,2737
Joan of Arc became a symbol of the Catholic League in the 16th century.,2738
Sue Sylvester is portrayed by an actress.,2739
Jimmy Carter is an American.,2740
Eleveneleven was founded by an American comedian.,2741
Michael Jackson was a dominant figure in popular music in the early 1980s.,2742
The Murder of Roger Ackroyd is a work of crime detective fiction.,2743
Kingdom Hearts III is developed by Square Enix.,2744
Grace Jones's style was influenced by funk.,2745
Grand Ole Pry hosted Patsy Cline.,2746
Sean Connery won a BAFTA Academy Fellowship Award and he is Scottish.,2747
Gujarat has a coastline.,2748
Sarcoidosis is a disease.,2749
Mary Marvel was one of the first female spin-offs.,2750
Gwen Stefani works as a fashion designer.,2751
The U.S. mainland is connected to Goat Island.,2752
Dave Franco stars in the movie Neighbors.,2753
Julia Louis-Dreyfus is a female actor.,2754
"Adele is from London, England.",2755
Prison Break was nominated for Favorite New TV Drama.,2756
Bob Dylan has been admitted into the Songwriters Hall of Fame.,2757
Jacqueline Kennedy Onassis was named one of the Most Admired Men and Women in 20th-century America by Gallup.,2758
Douglas Aircraft Company and McDonnell Aircraft formed McDonnell Douglas.,2759
Lust for Life is based on a 1934 novel.,2760
Tirumala Venkateswara Temple in Tirupati hosts 18.25 million visitors per year.,2761
Eazy-E's group released their first single in 1987.,2762
Ramayanam is a Telugu film.,2763
"Loving tells the story of the 1967 U.S. Supreme Court decision Loving v. Virginia, which invalidated state laws prohibiting interracial marriage.",2764
O. J. Simpson has been charged with more than one felony.,2765
Christopher Lee was a film actor.,2766
George W. Bush's brother is Jeb Bush.,2767
Jerry Goldsmith collaborated with Paul Verhoeven.,2768
The Celtic F.C. is based out of Glasgow.,2769
James Bryant Conant criticized the education system in the United States.,2770
Amsterdam has high growth rate within the city Proper.,2771
Paul Mantee has worked with movie director Byron Haskin.,2772
Joan Cusack worked with Matt Dillon and she is American.,2773
Thailand is not a constitutional monarchy.,2774
The Twilight Zone is an anthology series.,2775
Attack the Block was written by a man.,2776
Adrianne Palicki turned down a supporting role in John Wick.,2777
Radioactive received at least two nominations.,2778
R. Madhavan was in the cast of a movie.,2779
Lightning rod are called air terminals.,2780
Anton Yelchin performed in the late 1990s.,2781
"Tiger Woods collected $486,000 for winning a golf tournament.",2782
Judy Greer has appeared in multiple films.,2783
Hayden Panettiere starred in a drama.,2784
Prison Break has more than one season.,2785
The internet does not contain both local and global networks.,2786
George Foreman was rated as the eighth greatest heavyweight of all time by the IBRO.,2787
Alicia Keys made her film debut in Smokin' Aces.,2788
Katherine Heigl appeared in a science fiction television series.,2789
Google was founded in the 90's.,2790
Imperial is a county in Southern California.,2791
Timber is by Pitbull.,2792
Francis Ford Coppola does screenwriting.,2793
Patrick Wilson (American actor) acted in the second season of Fargo.,2794
Dwayne Johnson works part-time for WWE.,2795
Star Wars is a franchise from the United States.,2796
The Great Waldo Pepper had Margot Kidder in its cast.,2797
Bertrand Russell's work has had a great deal of influence on set theory.,2798
Role Models stars Jane Lynch.,2799
Marie Curie was a person.,2800
Shia LaBeouf received a Young Artist Award nomination.,2801
Melanie Griffith is a television actress.,2802
WALL-E won a Golden Globe Award.,2803
David Tennant portrayed the Tenth Doctor on Doctor Who.,2804
Alternative release platforms have been pioneered by Radiohead.,2805
Adrian Molina has worked on animated films.,2806
"It's Always Sunny in Philadelphia's second season aired on August 4, 2005.",2807
Rajon Rondo is a defensive basketball player.,2808
Alicia Keys debuted in a movie.,2809
Emma is an adaptation of an 1815 novel.,2810
Asteroid Day was co-founded by Grigorij Richters.,2811
What a Girl Wants earned a gold certification in Belgium.,2812
Jennifer Aniston is an American citizen.,2813
Red is a film that was released in 2010.,2814
Tyra Banks was a model.,2815
Elizabeth II conducted a state visit.,2816
Ted Kaczynski produced a manifesto.,2817
Funny or Die produces a show.,2818
One World Trade Center is tall.,2819
Sriti Jha plays the lead role in a TV show.,2820
Cher is sometimes referred to as the Goddess of Pop.,2821
"On October 31, 1969, Led Zeppelin II was released in the United Kingdom.",2822
Chester Bennington is an actor.,2823
The Fifth Element was the highest-grossing French movie in the international box office until the release of The Intouchables.,2824
Taal was romantic.,2825
Indiana Jones has been portrayed by American actor Sean Patrick Flanery.,2826
My Summer of Love is a 2004 British drama film.,2827
California Gurls was recorded by an American singer Katy Perry.,2828
Glenn Close made her debut in a 1974 play.,2829
Justin Bieber's fourth album came out in 2015.,2830
Northeast megalopolis includes small urban centers.,2831
Malcolm Young was a songwriter.,2832
Bruce Lee was in movies.,2833
Marion Cotillard achieved recognition.,2834
Lily James appeared in television roles.,2835
Jim Carrey was in the main cast of Mr. Popper's Penguins.,2836
Get Weird is the name of Little Mix's third album.,2837
Madonna released an album in 1983.,2838
Steffi Graf was highly ranked during her career.,2839
The Guest stars Leland Orser.,2840
Laurence Fishburne acted in Batman V Superman: Dawn of Justice.,2841
The Lion King's main character is a lion named Simba.,2842
Blake Edwards started as a performer.,2843
Gift of the Night Fury stars the voice of an actor born on June 4.,2844
Symptoms of measles eventually spread to the whole body.,2845
Ruth Negga has appeared in a horror film.,2846
Dennis Hopper acted in America.,2847
"David Schwimmer graduated from a university based in Evanston, Illinois.",2848
Paul Pogba is a sports player.,2849
"Richard Harris's date of birth was October 1, 1930.",2850
Gemma Arterton performed in the 2013 film Byzantium.,2851
Emily Blunt is British.,2852
Hot was by a British pop singer.,2853
Chris Brown did a duet with Jordin Sparks.,2854
Ecuador borders Colombia to the north.,2855
Gopalkrishna Gandhi is someone who was the 22nd person to govern a place.,2856
The Permanent Court of Arbitration is hosted in the Netherlands.,2857
Eddie Vedder was the vocalist of Pearl Jam.,2858
The brown bear is listed as a least concern species.,2859
Frank is in the form of a studio album.,2860
Portia de Rossi starred in Nip/Tuck.,2861
George A. Romero directed The Crazies.,2862
Remote Control Productions has provided the scores for The Lion King.,2863
Robert Chase worked under a fictional character Gregory House.,2864
The Beach Boys was a rock band from America.,2865
The Great Waldo Pepper had Margot Kidder in its cast.,2866
Logic was born in January 1990.,2867
Mother Teresa lived in Macedonia.,2868
Ben Affleck starred in The Voyage of Mimi.,2869
Varun Dhawan has been nominated for a Filmfare Award for Best Actor.,2870
Boston had the first subway system in the United States.,2871
Arnold Vinick is played by Alan Alda on The West Wing.,2872
Trolls is a musical romantic comedy adventure film.,2873
Robin appeared in DC comic books.,2874
Kobe Bryant was in the NBA.,2875
Reds is a 1981 film.,2876
"Klute was directed by an American film director, writer and producer.",2877
Will Ferrell was employed on a series created by Lorne Michaels.,2878
Queen Victoria's mother was Princess Victoria of Saxe-Coburg-Saalfeld.,2879
"Albany, New York, is one of the oldest surviving settlements in America.",2880
In 2005 T-Pain released an album.,2881
Asset management may apply to intangible assets such as financial assets.,2882
Rock music originated as rock and roll in the early 50's in the United States.,2883
"Hilda Ellis Davidson began life on October 1st, 1914.",2884
Stephen Rider acted in the series Lucky 7.,2885
Conor McGregor is a man.,2886
Emmy Rossum had a major role in a 2001 Hungarian-American biographical drama movie.,2887
See You Again (Miley Cyrus song) was remixed by an American record team.,2888
Halle Berry acted in Monster's Ball and modeled for Revlon.,2889
Prison Break was nominated for Favorite New TV Drama.,2890
Quentin Tarantino made the movie Reservoir Dogs.,2891
Gift of the Night Fury stars the voice of an actor born on June 4.,2892
Luke Evans has played Dracula.,2893
Conan O'Brien hosts a late-night talk show in the United States.,2894
Moscow has museums.,2895
Minions had two directors.,2896
Thinkin Bout You was nominated for Record of the Year.,2897
Overwatch was developed and published by Blizzard Entertainment.,2898
Allure is a women's magazine.,2899
Hate is practiced by a Hate group against a sexual orientation.,2900
Betty Buckley has been nominated for a Tony Award.,2901
Sofia Coppola acted in a drama film based on a novel.,2902
Gorillaz play hip hop music.,2903
Remote Control Productions has provided the scores for Transformers.,2904
William McKinley passed away in 1901.,2905
Despicable Me was animated by Mac Guff.,2906
Abraham Lincoln was rivals with Stephen A. Douglas during the 1850's.,2907
A Game of Thrones is fictional story.,2908
Apple Inc.'s consumer software includes the iOS operating system.,2909
Rumi's influence transcends national borders.,2910
Bradford contains a museum.,2911
Coldplay is from Britain.,2912
Dwayne Johnson was cut during the 1995 season.,2913
Joan Crawford was a dancer.,2914
Josh Friedman wrote The Black Dahlia.,2915
Nikola Tesla was a futurist.,2916
Kumkum Bhagya is an Indian soap opera.,2917
Belgium is 41% French-speaking.,2918
Tender Mercies is a film from the 1980's.,2919
A central venous catheter is also referred to as a central line.,2920
The Caracazo had victims.,2921
The Boston Celtics won the 1983-84 season.,2922
